Title,URL,Snippet
Join Our Team: Seeking Node.js/React.js/MERN Stack Developer ...,https://www.linkedin.com/posts/stackdot_join-our-team-seeking-nodejsreactjs-activity-7205976699308589057-kSVk,"Jun 10, 2024 ... Join Our Team: Seeking Node.js/React.js/MERN Stack Developer with Flutter Experience ... Full Stack Developer | Freelancer | Laravel | Codeigniter ..."
Join Our Team as a Full Stack Developer! Register Now!! 30 Nov ...,https://www.linkedin.com/posts/ktt_join-our-team-as-a-full-stack-developer-activity-7262711436252983297-Gssn,"Nov 13, 2024 ... Join Our Team as a Full Stack Developer! Register Now!! 30 Nov 2024."
Boiler Room is hiring! We're looking for a Full Stack Developer (Mid ...,https://www.linkedin.com/posts/boiler-room_boiler-room-is-hiring-were-looking-for-activity-7305242763434819585-2NZ_,"Mar 11, 2025 ... We're looking for a Full Stack Developer (Mid-Level) and a Junior Full Stack Developer to join our team in London."
Come join our team! | Mike Guhl,https://www.linkedin.com/posts/mikeguhl_senior-technologist-activity-7235264114770468864-dl14,"Aug 30, 2024 ... Come join our team! Its an exciting time to be a part of ... I have worked as a full-stack developer at Morescope since August ..."
Job Title: Full Stack Developer (Remote) We are looking for a ...,https://www.linkedin.com/posts/usama-arshad-jadoon-477676a8_%F0%9D%97%9D%F0%9D%97%BC%F0%9D%97%AF-%F0%9D%97%A7%F0%9D%97%B6%F0%9D%98%81%F0%9D%97%B9%F0%9D%97%B2-%F0%9D%97%99%F0%9D%98%82%F0%9D%97%B9%F0%9D%97%B9-%F0%9D%97%A6%F0%9D%98%81%F0%9D%97%AE%F0%9D%97%B0%F0%9D%97%B8-%F0%9D%97%97-activity-7280131829251080192-OmsP,"Jan 1, 2025 ... Job Title: Full Stack Developer (Remote) We are looking for a talented and passionate *Full Stack Developer* to join our team!"
Join Our Team: Junior Software Engineer | Toby Ruby,https://www.linkedin.com/posts/tobias-ruby_software-engineer-job-in-sydney-seek-activity-7298169509595553793-SOv5,"Feb 19, 2025 ... Join Our Team: Junior Software Engineer Are you passionate ... Full-stack developer | Cybersecurity Cert IV | Backend Engineering ..."
Join Our Remote Team! Open Roles: - Engineering Interns (Fresh ...,https://www.linkedin.com/posts/nawaljavaid_join-our-remote-team-open-roles-activity-7371585766327656448-K7Qq,"Sep 10, 2025 ... ... Full Stack Developer (Freelance Opportunity) Requirements: - Recent ... join our team and drive digital transformation in the insurance & broking ..."
Join Our Team at IndiaNIC Infotech Ltd. as a Full-Stack Developer ...,https://www.linkedin.com/posts/nupur-maheshwari-38715918a_join-our-team-at-indianic-infotech-ltd-activity-7280206193153765376-qvcv,"Jan 1, 2025 ... Join Our Team at IndiaNIC Infotech Ltd. as a Full-Stack Developer (.NET + Angular)! Are you a passionate and ambitious professional ready ..."
"Looking for a Full-Stack position? Join our team! (world-wide, CET ...",https://www.linkedin.com/posts/daniel-pfeffer_looking-for-a-full-stack-position-join-our-activity-6990927449848971265-hNXN,"Oct 25, 2022 ... Close menu. Looking for a Full-Stack position? Join our team! (world-wide ... As a Full Stack Developer in our company, you get a lot of ..."
Join Our Team: Full Stack Mobile Developer – Rwanda Location ...,https://www.linkedin.com/posts/alternatedoors_join-our-team-full-stack-mobile-developer-activity-7284472375188840448-BcHh,"Jan 12, 2025 ... Join Our Team: Full Stack Mobile Developer – Rwanda Location: Kigali, Rwanda (Hybrid – Remote & In-Person) We're on the hunt for a ..."
We're Hiring: Mobile Developer | Aneesa Hamid | 110 comments,https://www.linkedin.com/posts/aneesa-hamid-678560258_were-hiring-mobile-developer-activity-7296281164934197248-0KKf,"Feb 14, 2025 ... ... Join our team as a Mobile Developer and manage key tasks like develop and maintain high-quality mobile applications for both Android and iOS ..."
We are looking for a talented Mobile Developer (Flutter) to join our ...,https://www.linkedin.com/posts/roqqu_we-are-looking-for-a-talented-mobile-developer-activity-7258395071471861760-4sOy,"Nov 2, 2024 ... We are looking for a talented Mobile Developer (Flutter) to join our team! If you're passionate about creating seamless, innovative mobile ..."
We're hiring! | Colonist,https://www.linkedin.com/posts/colonist_were-hiring-are-you-a-gamer-excited-activity-7287091512205594624-FDVw,"Jan 20, 2025 ... ... join our team: UI/UX Designer: https://lnkd.in/dK8f8ZKf Mobile Developer: https://lnkd.in/diqEKJsJ Click the links to apply and become ..."
Join our team to build a fuel app for Nigeria | Anjolaoluwa Adeyemi ...,https://www.linkedin.com/posts/anjolaoluwa-adeyemi-04317622b_hiring-nigeriatech-fuelapp-activity-7314789181489143809-tL95,"Apr 6, 2025 ... Join our team to build a fuel app for Nigeria. View profile for ... Emmanuel A. Senior Full Stack Developer | Mobile Developer | open ..."
Are you a mobile developer looking for a new challenge? | Pulselive,https://www.linkedin.com/posts/teampulselive_home-pulselive-careers-activity-6864346304835850240-EPu-,"Nov 10, 2021 ... Are you a mobile developer looking for a new challenge? Do you know ... join our team, that means we're looking for Android and iOS ..."
WeareBLOX - Mobile Developer (React Native) | Minke R.,https://www.linkedin.com/posts/mvreeuwijk90_weareblox-mobile-developer-react-native-activity-7284953940767481856-3thV,"Jan 14, 2025 ... ... Mobile Developer (React Native) to join our team and help us build seamless, intuitive mobile experiences for our users. If you're ..."
#hiring #vancouvertech #mobiledevelopment #fullstack ...,https://www.linkedin.com/posts/pixieset_hiring-vancouvertech-mobiledevelopment-activity-7371218365404676096-UlIh,"Sep 9, 2025 ... ... Mobile Developer to join our team. As part of the team, you'll: Build and maintain high-quality mobile apps (one already has a 5-star ..."
HIRING Join Our Team at Orionik Technologies Private Limited! We ...,https://www.linkedin.com/posts/divya-dadhaniya-8928711ab_hiring-join-our-team-at-orionik-technologies-activity-7210230168718635008-OWea,"Jun 22, 2024 ... HIRING Join Our Team at Orionik Technologies Private Limited ... Mobile Developer IT Sales Backend Developer How to Apply: Interested ..."
Kupid TV | Ohm Patel,https://www.linkedin.com/posts/ohm-patel-84856223b_kupid-dating-1st-live-college-dating-show-activity-7299946484064555008-hH5k,"Feb 24, 2025 ... We're Hiring! KUPID Dating is on the lookout for a talented mobile developer to join our team! If you thrive in fast-moving startups and ..."
We are Hiring About the role : We are seeking a skilled iOS ...,https://www.linkedin.com/posts/codezyng_we-are-hiring-about-the-role-we-are-activity-7227544373788352512-VmBF,"Aug 8, 2024 ... We are Hiring About the role : We are seeking a skilled iOS Developer to join our team. As an iOS Developer, you will be responsible for ..."
#kptncook #greatplacetowork #jointheteam #mobileapp #android ...,https://www.linkedin.com/posts/kptncook_kptncook-greatplacetowork-jointheteam-activity-7016386727510482944-4-a_,"Jan 4, 2023 ... Come aboard, Kptn! Join our team in Berlin and get involved in our mission to empower ... iOS Developer (M/F/X)! We're looking forward ..."
Meesho - SDE I - iOS Developer | Yukta Shrivastava | 18 comments,https://www.linkedin.com/posts/yuktashrivastava7429418b_meesho-sde-i-ios-developer-activity-7180557779688910848-mTFS,"Apr 1, 2024 ... Join Our team as a SDE I - iOS Developer at Meesho Are you ready to take your #iOS development skills to the next level?"
#job #ios #iosdeveloper #onedata #coimbatore #hiring #feed ...,https://www.linkedin.com/posts/onedata-software-solutions_job-ios-iosdeveloper-activity-7245304613422186496-avWe,"Sep 26, 2024 ... We're hiring! Join our team as an iOS Developer. Experience: Minimum 2+ Years Location: Coimbatore, Tamil Nadu (Onsite) Send us your ..."
Welcome to the team Matias Espinach and Muhammad Abad! Two ...,https://www.linkedin.com/posts/ckiani_welcome-to-the-team-matias-espinach-and-muhammad-activity-7355674900352692224-zN5B,"Jul 28, 2025 ... ... join our team: iOS Developer https://lnkd.in/gdrWXF2Z Technical Project Manager (Mobile Apps) https://lnkd.in/gxRZqCre If you or ..."
We're Hiring! Join Our Team! ‼️ We Webcontrive Technologies Pvt ...,https://www.linkedin.com/posts/priti-chavda-8b534a246_%F0%9D%97%AA%F0%9D%97%B2%F0%9D%97%BF%F0%9D%97%B2-%F0%9D%97%9B%F0%9D%97%B6%F0%9D%97%BF%F0%9D%97%B6%F0%9D%97%BB%F0%9D%97%B4-%F0%9D%97%9D%F0%9D%97%BC%F0%9D%97%B6%F0%9D%97%BB-%F0%9D%97%A2%F0%9D%98%82%F0%9D%97%BF-activity-7285631524576661504-NWqD,"Jan 16, 2025 ... ... IOS Developer (Experience: 1 to 3 years) 9. Digital Marketer ( ... Join our team and share your resume at: +91 8780596299 hr ..."
We're Hiring at coto! We're looking for talented iOS and Android ...,https://www.linkedin.com/posts/ruchika-motwani-karda-18ba3a86_were-hiring-at-coto-were-looking-for-activity-7346042720219508736-Ew-Z,"Jul 1, 2025 ... We're Hiring at coto! We're looking for talented iOS and Android Developers to join our team ... iOS Developer ✓ Android Developer Location: ..."
#ios #engineer #opportunity #portugal | Anton Herasymenko,https://www.linkedin.com/posts/antonherasymenko_ios-engineer-opportunity-activity-7041352266095673344-TRyC,"Mar 14, 2023 ... We are seeking a Senior iOS Developer to join our team in Portugal and help us continue to deliver exceptional services to our clients!"
"Hello Professionals, We are looking for enthusiastic candidates to ...",https://www.linkedin.com/posts/codefliestechnologies_hello-professionals-we-are-looking-for-activity-6367639099804868608-34lo,"Feb 9, 2018 ... Hello Professionals, We are looking for enthusiastic candidates to join our team ... IOS Developer (1-3 yrs exp) 7) Hybrid Developer (1-3 yrs exp) ..."
Join Our Team at Motivity Labs Inc! Immediate Hiring for UI PATH ...,https://www.linkedin.com/posts/swapna-m-43286b20a_join-our-team-at-motivity-labs-inc-immediate-activity-7135209024744026112-fpIA,"Nov 28, 2023 ... Join Our Team at Motivity Labs Inc! Immediate Hiring for UI ... Swapna M's Post. View profile for Swapna M · Swapna M. Hiring| IOS Developer ..."
Join Our Team: Hiring Android Developer & UI/UX Designer | Qtonz ...,https://www.linkedin.com/posts/qtonz-infosoft-pvt-ltd_join-our-team-hiring-android-developer-activity-7209546535741624320-n69Y,"Jun 20, 2024 ... ... join our team in #Rajkot! 📽️ Check out this video to learn more ... Join Our Team: Hiring Android Developer & UI/UX Designer. View ..."
Join our team at Worldline Global Services! We are hiring an ...,https://www.linkedin.com/posts/nitishranjanyadav_join-our-team-at-worldline-global-services-activity-7236622149854081024-MQiu,"Sep 2, 2024 ... Jimit Raval. Software Development Analyst (Android Automotive) @ Accenture | ex System Engineer (Android Developer) at TCS | Android Automotive ..."
Join Our Team at Atos Group! We are excited to announce several ...,https://www.linkedin.com/posts/salma-foughal-787347113_%F0%9D%91%B1%F0%9D%92%90%F0%9D%92%8A%F0%9D%92%8F-%F0%9D%91%B6%F0%9D%92%96%F0%9D%92%93-%F0%9D%91%BB%F0%9D%92%86%F0%9D%92%82%F0%9D%92%8E-%F0%9D%92%82%F0%9D%92%95-%F0%9D%91%A8%F0%9D%92%95%F0%9D%92%90%F0%9D%92%94-activity-7357059826981523458-Xvd4,"Aug 1, 2025 ... Join Our Team at Atos Group! We are ... Android developer Mid-senior to Senior Level -Backend Java developer ..."
We're Hiring: Android Developer | Aiman Azim | 37 comments,https://www.linkedin.com/posts/aiman-azim-54393b275_pakwheels-androiddeveloper-hiring-activity-7351201935095476224-BFCQ,"Jul 16, 2025 ... We're Hiring: Android Developer Join our team and help build seamless, high-performance Android applications! What You'll Do: Develop apps ..."
We're Hiring! Join Our Team! ‼️ We Webcontrive Technologies Pvt ...,https://www.linkedin.com/posts/priti-chavda-8b534a246_%F0%9D%97%AA%F0%9D%97%B2%F0%9D%97%BF%F0%9D%97%B2-%F0%9D%97%9B%F0%9D%97%B6%F0%9D%97%BF%F0%9D%97%B6%F0%9D%97%BB%F0%9D%97%B4-%F0%9D%97%9D%F0%9D%97%BC%F0%9D%97%B6%F0%9D%97%BB-%F0%9D%97%A2%F0%9D%98%82%F0%9D%97%BF-activity-7285631524576661504-NWqD,"Jan 16, 2025 ... ... Android Developer (Experience: 1 to 3 years) 8. IOS Developer ... Join our team and share your resume at: +91 8780596299 hr ..."
We're Hiring: Mobile Developer | Aneesa Hamid | 110 comments,https://www.linkedin.com/posts/aneesa-hamid-678560258_were-hiring-mobile-developer-activity-7296281164934197248-0KKf,"Feb 14, 2025 ... ... Join our team as a Mobile Developer and manage key tasks like ... Android Developer (Java, Kotlin, Jetpack Compose) || Sr. Flutter ..."
#webdevelopment #webdevelopers #android #androiddevelopers ...,https://www.linkedin.com/posts/webguru-infosystems-pvt--ltd-_webdevelopment-webdevelopers-android-activity-7373693939171725312-ozRA,"Sep 16, 2025 ... Join our team... we are expanding #webdevelopment # ... Kivy KivyMD Android Developer . M.Sc. Physics. 1d. Report this ..."
Join Our Team - SQA Analyst | Contour Software | 15 comments,https://www.linkedin.com/posts/contoursoftware_join-our-team-sqa-analyst-activity-7267877458501148672-SFtE,"Nov 28, 2024 ... Join Our Team - SQA Analyst • 2 pages 2 pages. Accessibility ... Masood Azeem. Android Developer at Marshal Fintech Partners | Android ..."
Meet people from our Team Tech & join them! | Sympatient,https://www.linkedin.com/posts/sympatient-gmbh_%F0%9D%97%A0%F0%9D%97%B2%F0%9D%97%B2%F0%9D%98%81-%F0%9D%97%BD%F0%9D%97%B2%F0%9D%97%BC%F0%9D%97%BD%F0%9D%97%B9%F0%9D%97%B2-%F0%9D%97%B3%F0%9D%97%BF%F0%9D%97%BC%F0%9D%97%BA-%F0%9D%97%BC%F0%9D%98%82%F0%9D%97%BF-%F0%9D%97%A7%F0%9D%97%B2%F0%9D%97%AE%F0%9D%97%BA-activity-7270006326829735936-uiFy,"Dec 4, 2024 ... ... join our team! Job Description: Objective: To develop a custom video ... Android Developer Support Engineer to assist customers with ..."
We're Hiring at coto! We're looking for talented iOS and Android ...,https://www.linkedin.com/posts/ruchika-motwani-karda-18ba3a86_were-hiring-at-coto-were-looking-for-activity-7346042720219508736-Ew-Z,"Jul 1, 2025 ... We're Hiring at coto! We're looking for talented iOS and Android Developers to join our team ... Android Developer Location: Remote Flexible, ..."
We are thrilled to have Ishan join our team as a QA Engineer ...,https://www.linkedin.com/posts/progressive-labs-dev-agency_teamprogressivelabs-welcomeaboard-activity-7308007243927433216-TSbe,"Mar 18, 2025 ... We are thrilled to have Ishan join our team as a QA Engineer. Welcome aboard! #TeamProgressiveLabs #WelcomeAboard | 11 comments on ..."
We're seeking a Quality Assurance Engineer to join our team for the ...,https://www.linkedin.com/posts/bluepi-group_were-seeking-a-quality-assurance-engineer-activity-7201068706234314753-CQYs,"May 27, 2024 ... We're seeking a Quality Assurance Engineer to join our team for the new product. Let's start a challenge!!! The Job Description: QA Engineer ..."
We're Hiring! Manual QA Engineer ! Join our team as a Manual QA ...,https://www.linkedin.com/posts/aarthi-murugan-1836322b7_were-hiring-manual-qa-engineer-activity-7290937762734641153-TwWq,"Jan 30, 2025 ... We're Hiring! Manual QA Engineer ! Join our team as a Manual QA Engineer and help ensure top-notch quality in our products!"
**Job Title: QA Engineer** **Location:** Remote within USA ...,https://www.linkedin.com/posts/staffingall_job-title-qa-engineer-location-activity-7213175369221185537-3qOI,"Jun 30, 2024 ... ... QA Engineer to join our team. The ideal candidate will have a strong background in quality assurance methodologies and testing techniques ..."
We're Hiring! Join Our Team as a Technical Support Engineer Are ...,https://www.linkedin.com/posts/buildbot-technologies-private-limited_were-hiring-join-our-team-as-a-technical-activity-7339255404255657986-i6Bi,"Jun 13, 2025 ... ... join our team at Buildbot Technologies! Roles & Responsibilities ... Driven QA Engineer | Cybersecurity & Testing Enthusiast | Ensuring ..."
#qa #automationtester #jobs #saudiarabia | Basma Al-Qadiri | 118 ...,https://www.linkedin.com/posts/basma-al-qadiri-85b22b19a_qa-automationtester-jobs-activity-7297950447678480385-_FB0,"Feb 19, 2025 ... We're Hiring! Join our Wareef Team We are looking for a skilled QA Automation Engineer to join our team ... Software Qa Engineer ISTQB-CTFL4."
Apply to join our team today! | Cointab,https://www.linkedin.com/posts/cointab_apply-to-join-our-team-today-activity-7168183283648786432-C0Yk,"Feb 27, 2024 ... ... QA Engineer Apply now by sending your resume to hr@cointab.net! Your ... Apply to join our team today! 38 7 Comments · Like Comment. Share."
QA Engineer - Marketing - Remote (to GMT +2) / Dublin - Phorest ...,https://www.linkedin.com/posts/phorest_qa-engineer-marketing-remote-to-gmt-activity-7059914813933506560-vsXG,"May 4, 2023 ... wearehiring for a QA Engineer - Marketing - Remote (to GMT +2) / Dublin to join our team Phorest powers over 10000 hair and beauty salons ..."
TekBank is looking for two talented people to join our team ...,https://www.linkedin.com/posts/john-moore-44021b84_tekbank-is-looking-for-two-talented-people-activity-7371504296330231808-gMwr,"Sep 10, 2025 ... TekBank is looking for two talented people to join our team: Laserfiche Implementation Engineer Laserfiche QA Engineer Location: ..."
We're Hiring! Join Our Team at Tricode! Location: Onsite in ...,https://www.linkedin.com/posts/tricodellp_%F0%9D%91%BE%F0%9D%92%86%F0%9D%92%93%F0%9D%92%86-%F0%9D%91%AF%F0%9D%92%8A%F0%9D%92%93%F0%9D%92%8A%F0%9D%92%8F%F0%9D%92%88-join-our-team-at-activity-7199630255072894976-3OWr,"May 23, 2024 ... Join Our Team at Tricode! Location ... Immediate Joiner | Software QA Engineer | Ex - Capgemini Engineering, Times Internet."
**Job Title: DevOps Engineer** **Location:** Remote within USA ...,https://www.linkedin.com/posts/staffingall_job-title-devops-engineer-location-activity-7210666256239050753-uT-u,"Jun 23, 2024 ... We are looking for a skilled DevOps Engineer to join our team. The ideal candidate will have a strong background in software development, operations, and ..."
Join Our Team as a Mid-Level DevSecOps Engineer! | Diamond ...,https://www.linkedin.com/posts/diamondtrustbank_ikokazike-hiring-devsecops-activity-7255464681409044482-Hif8,"Oct 24, 2024 ... Join Our Team as a Mid-Level DevSecOps Engineer! Are you passionate ... DevOps Engineer | Cloud & Automation | CI/CD | IaC | Scalable ..."
#awsinternship #devopsengineerintern #awsdevops ...,https://www.linkedin.com/posts/avanexa-technologies_awsinternship-devopsengineerintern-awsdevops-activity-7266668663636656128-ABkV,"Nov 24, 2024 ... Join Our Team as an AWS DevOps Engineer Intern We're on the lookout for passionate and motivated individuals to join us as AWS DevOps ..."
Join Our Dynamic Team! Are you ready to embark on an exciting ...,https://www.linkedin.com/posts/brainstation-23_join-our-dynamic-team-are-you-ready-to-embark-activity-7249802546595151872-ETP3,"Oct 9, 2024 ... talented and experienced professionals to join our team! We have an exciting opportunity for the positions of DevOps Engineer, React Native ..."
Meet Dzovag Soghomonian — she's hiring! We're looking for two ...,https://www.linkedin.com/posts/asianlogic-ltd.---bayview-technologies_meet-dzovag-soghomonian-shes-hiring-activity-7374719209823555584-mKgh,7 days ago ... We're looking for two talented professionals to join our team at Sportserve: Platform DevOps Engineer Senior Delivery Engineer If you're ...
Join Our Team as a DevOps Intern at Adda247! Are you ready to ...,https://www.linkedin.com/posts/sakshinigam2000_join-our-team-as-a-devops-intern-at-adda247-activity-7265340823657943040-GJns,"Nov 21, 2024 ... Join Our Team as a DevOps Intern at Adda247! Are you ready to ... DevOps Engineer [immediate joiner] | 2 YOE (AWS DevOps) @Capgemini ..."
We are hiring! Join our team! | Paola Scampini,https://www.linkedin.com/posts/paolascampini_we-are-hiring-join-our-team-activity-7289981288176885760-T5Nz,"Jan 28, 2025 ... ... join our team and help us achieve our vision. We are currently ... DevOps engineer - https://lnkd.in/dSTTRYD2 Engineering Manager ..."
"Taking a break is key! In summer, the Alps call. Majestic peaks ...",https://www.linkedin.com/posts/ann-cass-phd-b584916b_taking-a-break-is-key-in-summer-the-alps-activity-7361784989744603138-dCLx,"Aug 14, 2025 ... DevOps Engineer sanofi.wd3.myworkdayjobs.com. 21 · Like ... Join our team at Sanofi's US Digital Commercial organization ..."
#hiring #hiring #devopsengineer #hyderabadjobs #dataquad ...,https://www.linkedin.com/posts/dataquadinc_hiring-hiring-devopsengineer-activity-7221533998865432576-3yhn,"Jul 23, 2024 ... We are #hiring Join our team at Dataquad Inc. in Hyderabad! We're on the lookout for a DevOps Engineer. If you're passionate about ..."
#datamarshall #hiring #devopsengineer #hyderabad | Data Marshall,https://www.linkedin.com/posts/data-marshall_datamarshall-hiring-devopsengineer-activity-7271886868319727617--LDg,"Dec 9, 2024 ... Join Our Team as a DevOps Engineer! Are you a DevOps Engineer with 5 years of experience? We're looking for someone like you to join our ..."
We're hiring! Data Scientist We are seeking a talented Data Scientist ...,https://www.linkedin.com/posts/anthelion-capital_were-hiring-data-scientist-we-are-seeking-activity-7288259822997708801-kjhJ,"Jan 23, 2025 ... We are seeking a talented Data Scientist to join our team in New York City. The ideal candidate will have a strong background in data science, quantitative ..."
Join Our Team as a Climate Data Scientist Working Student! | Thijs ...,https://www.linkedin.com/posts/thijs-markwat-01820715_join-our-team-as-a-climate-data-scientist-activity-7243993378592342017-seST,"Sep 23, 2024 ... Join Our Team as a Climate Data Scientist Working Student! Why You Should Apply: - Make a Difference: Work on impactful projects that ..."
We're excited to share a new opportunity to join our team as a Data ...,https://www.linkedin.com/posts/melissakwilosz_affinaquest-data-scientist-activity-7311139797845123073-EDTV,"Mar 27, 2025 ... We're excited to share a new opportunity to join our team as a Data Scientist! If you're passionate about data science and predictive analytics, this could be ..."
Join Our Team as a Commodity Data Scientist at LDC! | Qing Wang,https://www.linkedin.com/posts/qing-wang-raymond_join-our-team-as-a-commodity-data-scientist-activity-7247623023615229953-x7FJ,"Oct 3, 2024 ... Join Our Team as a Commodity Data Scientist at LDC! At LDC, data science drives objective, quantitative, and timely decision-making ..."
I am hiring a Data Scientist to join our team at Ontario Health! This ...,https://www.linkedin.com/posts/davood-astaraky-5387a52a_i-am-hiring-a-data-scientist-to-join-our-activity-7311830343920078848-l5H3,"Mar 29, 2025 ... I am hiring a Data Scientist to join our team at Ontario Health! This role is a great opportunity to build end-to-end AI and NLP models for ..."
Join Our Team as a Lead Data Scientist | Daniel R Mower,https://www.linkedin.com/posts/danielrmower_data-scientist-lead-bank-aiml-activity-7353113446755823617-Zusi,"Jul 21, 2025 ... Join Our Team as a Lead Data Scientist We're seeking an experienced Lead Data Scientist to join USAA and shape the future of AI/ML projects ..."
Join Our Team ICICI Lombard as a Data Scientist (Generative AI ...,https://www.linkedin.com/posts/akash-agrawal-9714696b_join-our-team-icici-lombard-as-a-data-activity-7190749435553890304-ubIp,"Apr 29, 2024 ... Join Our Team ICICI Lombard as a Data Scientist (Generative AI) Are you passionate about pushing the boundaries of artificial intelligence ..."
"Attention developers with Tableau, PowerBI, and Alteryx skills ...",https://www.linkedin.com/posts/dustincabral_attention-developers-with-tableau-powerbi-activity-7184970731494023168-GaXk,"Apr 13, 2024 ... Cleartelligence is expanding rapidly and we want YOU to join our team ... Data Analyst | Business Intelligence Analyst | Data Scientist | 4+ ..."
Join Our Team at KDys Lab! Positions Available: 1- Jr. Data Scientist ...,https://www.linkedin.com/posts/kdys-lab_join-our-team-at-kdys-lab-positions-activity-7164210011097710592-1kur,"Feb 16, 2024 ... Join Our Team at KDys Lab! Positions Available: 1- Jr. Data Scientist 2- Trainee Data Scientists. Why KDys lab (Pvt) Ltd Is Your Next Adventure."
Human Centered AI - Data Scientist - ASE - Jobs at Apple (SG ...,https://www.linkedin.com/posts/mingkamon-buathang-a10243196_human-centered-ai-data-scientist-ase-activity-7307644060398166016-NgUE,"Mar 17, 2025 ... Join Our Team as a Human-Centered AI Data Scientist at Apple! Our team at Apple is looking for a Data Scientist to help build intelligent, user-centric ..."
AutoNation is looking for a Data Engineer to join our team! As a Data ...,https://www.linkedin.com/posts/autonation_autonation-is-looking-for-a-data-engineer-activity-6822936105181151232-Wmwm,"Jul 19, 2021 ... AutoNation is looking for a Data Engineer to join our team! As a Data Engineer, you will be responsible for providing operational and ..."
Join Our Team as a Databricks Data Engineer! Are you a seasoned ...,https://www.linkedin.com/posts/padmavathy-godavarthi-1251035_join-our-team-as-a-databricks-data-engineer-activity-7285685552652177408-DTRN,"Jan 16, 2025 ... Join Our Team as a Databricks Data Engineer! Are you a seasoned professional with a passion for data engineering and analytics?"
RUBICON is looking for a Data Engineer to join our team! In this role ...,https://www.linkedin.com/posts/rubicon-world_rubicon-is-looking-for-a-data-engineer-to-activity-7259499847760703489-pgDG,"Nov 5, 2024 ... RUBICON is looking for a Data Engineer to join our team! In this role, you will design and develop data pipelines, models, and analyses that ..."
