Title,URL,Snippet
My freelance rate is ~100 Euro per hour. I still here from so many ...,https://www.linkedin.com/posts/joe-wilhelm_my-freelance-rate-is-100-euro-per-hour-activity-7288535813934518272-m0GP,"Jan 24, 2025 ... My freelance rate is ~100 Euro per hour. I still here from so ... Software engineer | Mobile App Developer | Prompt engineer | Flutter ..."
I'm excited to share that Andrew Qu saw the opportunity I posted ...,https://www.linkedin.com/posts/malteubl_im-excited-to-share-that-andrew-qu-saw-the-activity-7311074000846077953-dcqI,"Mar 27, 2025 ... ... Software Engineer in Residence in Vercel's office of the CTO. | 20 ... Freelance Software Engineer. 5mo. Report this comment; Close menu."
I challenged a software engineer to design his very first PCB. This is ...,https://www.linkedin.com/posts/robfer_i-challenged-a-software-engineer-to-design-activity-7323282418839269376-kcFz,"Apr 30, 2025 ... Freelance senior electronic and software engineer. 4mo. Report this comment; Close menu. Just a short review on the review... A power port is ..."
I made my first million dollars as a software engineer at 27 years old ...,https://www.linkedin.com/posts/christian-l%C3%BCdemann-075652104_i-made-my-first-million-dollars-as-a-software-activity-6875449091346731008-LMH2,"Dec 11, 2021 ... I made my first million dollars as a software engineer at 27 years old ... freelance contract + coaching, making $300K 27: Lead developer ..."
#contentcreator #buzzword #journey #tech #career #content ...,https://www.linkedin.com/posts/laura-oliveira-mobile_contentcreator-buzzword-journey-activity-7373847555304165376-ZvsT,"Sep 16, 2025 ... ... freelance projects and #fulltime opportunities with #relocation. ⸻ ‍ Laura Oliveira #MobileDeveloper | Android | Kotlin | Java | MVVM ..."
Doing Leetcode is the worst way to prepare for a high-paying job as ...,https://www.linkedin.com/posts/johncrickett_doing-leetcode-is-the-worst-way-to-prepare-activity-7203364879771037697-u6ej,"Jun 3, 2024 ... Jarrett Yew. Freelance Software Engineer (Ruby on Rails, React Native/Expo) • Full-stack Developer • AWS & Postgres • Artificial Intelligence ..."
from Reddit 'The era of AI slop cleanup has begun I'm a freelance ...,https://www.linkedin.com/posts/murrayrobinson_from-reddit-the-era-of-ai-slop-cleanup-has-activity-7357539172879884289-H1--,"Aug 2, 2025 ... from Reddit 'The era of AI slop cleanup has begun I'm a freelance software engineer with about 8 years of experience, mainly in early-stage ..."
How to succeed in software engineering: Kidlin's Law and Pareto's ...,https://www.linkedin.com/posts/mattwatsonkc_software-engineering-is-mostly-about-two-activity-7369431567284301825-yO7Q,"Sep 4, 2025 ... Jarrett Yew. Freelance Software Engineer (Ruby on Rails, React Native/Expo) • Full-stack Developer • AWS & Postgres • Artificial Intelligence ..."
Why I chose frontend after a freelance project | Yoginder Kumar ...,https://www.linkedin.com/posts/yoginderkumar_people-often-ask-why-frontend-and-honestly-activity-7239664433579335682-UGii,"Sep 11, 2024 ... ... freelance project. The backend? Knocked it out in two weeks. Was it ... Backend Engineer | C# | .NET Core | .NET Framework | Entity ..."
A Day in the Life of a Muslim Software Engineer: Ramadan Edition ...,https://www.linkedin.com/posts/sajjaad-khader_a-day-in-the-life-of-a-muslim-software-engineer-activity-7309995352797949952-K5Cd,"Mar 24, 2025 ... MERN-Stack Developer || Backend Engineer || Freelance Full Stack Developer || Intern @ NCAI || Python Programmer || Software engineering student ..."
I'm A $3B Founder. Here Are 7 AI Business Ideas. | Shaan Puri,https://www.linkedin.com/posts/shaanpuri_im-a-3b-founder-here-are-7-ai-business-activity-7333569017787371521-L0Yd,"May 28, 2025 ... Freelance backend engineer | AI enthusiast. 3mo. Report this comment; Close menu. I love those two ideas: - v0 for video games - AI first ..."
#startups #entrepreneurship #buildinpublic | Neahme Jbaily | 32 ...,https://www.linkedin.com/posts/neahme-jbaily_startups-entrepreneurship-buildinpublic-activity-7168562992144494593-3LuR,"Feb 28, 2024 ... Elia El Atram. Freelance Backend engineer | Node.js | AWS | Cloud | MySql | MongoDB. 1y. Report this comment; Close menu. Best mindset out there ..."
#startup #techfounders | Maxime Arnulf | 10 comments,https://www.linkedin.com/posts/maxime-arnulf_startup-techfounders-activity-7150062612804730880-K0HW,"Jan 8, 2024 ... Freelance backend engineer | AI enthusiast. 1y. Report this comment; Close menu. Great insights. Where can I find the full interview Maxime ..."
Why I quit using ChatGPT 5 for debugging | Muqaddas Mehboob ...,https://www.linkedin.com/posts/muqaddas-mehboob_chatgpt-ai-softwaredevelopment-activity-7368857667181649921-An2N,"Sep 2, 2025 ... MERN-Stack Developer || Backend Engineer || Freelance Full Stack ... MERN-Stack Developer || Backend Engineer || Freelance Full Stack ..."
Why Coding Is One of the Best Skills to Learn | Tim Ruscica posted ...,https://www.linkedin.com/posts/tim-ruscica_why-coding-is-one-of-the-best-skills-to-learn-activity-7305002158767112193-_re2,"Mar 10, 2025 ... ... freelance gigs, teach programming, or build your own projects ... Backend Engineer || AWS Certified || Embedded Systems & APIs. 5mo."
"Just wrapped up a landing page design concept, and I'm excited to ...",https://www.linkedin.com/posts/daksh777_just-wrapped-up-a-landing-page-design-concept-activity-7287343333910224896-8LE6,"Jan 20, 2025 ... ... freelance or contract work. If you're looking for a designer with ... Yash Raj. Backend Engineer @Yarasi | Member at Django Software ..."
Vibe coding is good. I can drink a glass of wine while waiting for my ...,https://www.linkedin.com/posts/sebastienstormacq_vibe-coding-is-good-i-can-drink-a-glass-activity-7314350803635363840-GRzB,"Apr 5, 2025 ... Freelance cloud architect. 5mo. Report this comment; Close menu. ""Q ... Backend Engineer (Django, Rest Framework, FastAPI) • Communities ..."
How I messed up my NVIDIA interview and what I learned | Priyank ...,https://www.linkedin.com/posts/priyank-vyas-31march1999_microsoft-nvidia-interviews-activity-7371234539827875840-eK-A,"Sep 9, 2025 ... Software Developer at Freelance. 1w. Report this comment; Close ... Immediate Joiner | Backend Engineer | LeetCode Knight (Top 6% Global) ..."
Why I chose frontend after a freelance project | Yoginder Kumar ...,https://www.linkedin.com/posts/yoginderkumar_people-often-ask-why-frontend-and-honestly-activity-7239664433579335682-UGii,"Sep 11, 2024 ... Why I chose frontend after a freelance project. View profile for Yoginder Kumar · Yoginder Kumar. Sr. Frontend Engineer | React/Next.js | SaaS ..."
I am hiring a Software Engineer with at least 3 years experience ...,https://www.linkedin.com/posts/jasonlevigoodison_i-am-hiring-a-software-engineer-with-at-least-activity-7264732152708087809-4p1n,"Nov 19, 2024 ... 19yo Freelance Frontend Engineer | Design and code interfaces that are seamless and performant | Building reusable & scalable component ..."
"I received an email from my ex last night. My ex-company, Meta. Not ...",https://www.linkedin.com/posts/yangshun_i-received-an-email-from-my-ex-last-night-activity-7356264674868256768-jUoE,"Jul 30, 2025 ... Akhil Nair. Senior Frontend Engineer @ FamPay – React ... 19yo Freelance Frontend Engineer | Design and code interfaces that ..."
Senior Front End Software Engineer | Yangshun Tay | 55 comments,https://www.linkedin.com/posts/yangshun_senior-front-end-software-engineer-activity-7292422886919651329-hN0T,"Feb 3, 2025 ... Zia Ur Rehman Khan. 19yo Freelance Frontend Engineer | Design and code interfaces that are seamless and performant | Building reusable ..."
Chasing women didn't get me far. But chasing my goals? That ...,https://www.linkedin.com/posts/vicktipnes_chasing-women-didnt-get-me-far-but-chasing-activity-7301313126212268032-pL9n,"Feb 28, 2025 ... ... Freelance Frontend Engineer | Entrepreneur | Game Designer & Developer | Creativity Enthusiast. 6mo. Report this comment; Close menu. In my ..."
First day back at the gym today. It's been six months. Whilst I've lost a ...,https://www.linkedin.com/posts/james-mahy_first-day-back-at-the-gym-today-its-been-activity-7369778874760572929-XCTD,"Sep 5, 2025 ... 19yo Freelance Frontend Engineer | Design and code interfaces that are seamless and performant | Building reusable & scalable component ..."
Assuming there really are ~26M software developers globally: how ...,https://www.linkedin.com/posts/gergelyorosz_assuming-there-really-are-26m-software-developers-activity-7197919240689991680--3eg,"May 19, 2024 ... Freelance Senior Frontend Engineer | React.js Milano meetup organizer. 1y. Report this comment; Close menu. I bet 80+% of the worldwide IT and ..."
$200 a month for Claude Code is hands down my favorite expense ...,https://www.linkedin.com/posts/grammakov_200-a-month-for-claude-code-is-hands-down-activity-7367907223714295808-IfKr,"Aug 31, 2025 ... Zia Ur Rehman Khan. 19yo Freelance Frontend Engineer | Design and code interfaces that are seamless and performant | Building reusable ..."
How a client's onboarding form response revealed their work style ...,https://www.linkedin.com/posts/shreya-pattar_last-year-a-client-filled-out-our-entire-activity-7367498549753794561-5uO5,"Aug 30, 2025 ... Zia Ur Rehman Khan. 19yo Freelance Frontend Engineer | Design and code interfaces that are seamless and performant | Building reusable ..."
How direct everyone is in Poland | Dori Adar posted on the topic ...,https://www.linkedin.com/posts/dori-adar-48532b55_first-time-in-poland-one-thing-that-strikes-activity-7198674767112024064-G6j3,"May 21, 2024 ... ... Freelance Frontend Engineer | Entrepreneur | Game Designer & Developer | Creativity Enthusiast. 1y. Report this comment; Close menu. What ..."
Why I chose frontend after a freelance project | Yoginder Kumar ...,https://www.linkedin.com/posts/yoginderkumar_people-often-ask-why-frontend-and-honestly-activity-7239664433579335682-UGii,"Sep 11, 2024 ... ... freelance project. The backend? Knocked it out in two weeks. Was it ... Frontend Developer | Web Developer | Full Stack Developer (In ..."
A Day in the Life of a Muslim Software Engineer: Ramadan Edition ...,https://www.linkedin.com/posts/sajjaad-khader_a-day-in-the-life-of-a-muslim-software-engineer-activity-7309995352797949952-K5Cd,"Mar 24, 2025 ... MERN-Stack Developer || Backend Engineer || Freelance Full Stack Developer || Intern @ NCAI || Python Programmer || Software engineering student ..."
"""Vibe-coding is really fun, and this has been the best vacation I've ...",https://www.linkedin.com/posts/kevinkuipers_vibe-coding-is-really-fun-and-this-has-activity-7368159075328610304-bYI-,"Aug 31, 2025 ... Emmanuel LOUISY-GABRIEL. Freelance Full-Stack Developer | Ruby on Rails + Hotwire Expert | 10+ YOE | AI Automation | Available for 3+ Mo ..."
Switched to Jest with GitHub Copilot's help | Loiane G. posted on the ...,https://www.linkedin.com/posts/loiane_created-a-new-angular-v20-project-and-switched-activity-7332151575341056001-bU4X,"May 24, 2025 ... Justice Nanhou. Freelance Full Stack Developer | Java ☕ | Kubernetes ⚙️ | DevOps Automation | Microservices Architect 🏗️ | Cloud ..."
"Hello everyone, I am super excited to share that I have completed ...",https://www.linkedin.com/posts/bhaswatiroy31_hello-everyone-i-am-super-excited-to-share-activity-7105211225034092545-RWTM,"Sep 6, 2023 ... Interned at Accenture and CodemateAI | Passionate Full-Stack Developer ... Java | MERN Stack Developer | AWS | Linux | Freelance Full-stack ..."
Two unrelated thoughts on taste and skeuomorphism: 1. One reason ...,https://www.linkedin.com/posts/dashinsky_two-unrelated-thoughts-on-taste-and-skeuomorphism-activity-7335943179650625536-NVt-,"Jun 4, 2025 ... Christian Jöcker. Freelance Full-Stack Developer | IoT, AI, Web Apps ... Fedor Shkliarau. Freelance product design partner for startups | Author ..."
Reminder: It took me 2 years to work freelance JUST to land a first ...,https://www.linkedin.com/posts/annamiller_reminder-it-took-me-2-years-to-work-freelance-activity-7188278772582830080-u1Xq,"Apr 22, 2024 ... Full Stack Developer | IT support. 1y. Report this comment; Close menu. Anna Miller Where did you freelance, Upwork or some other platform?"
How Coding Helps With Leadership | David Anusontarangkul,https://www.linkedin.com/posts/anusontarangkul_how-coding-helps-with-leadership-activity-7371182591452000256-Jkcy,"Sep 9, 2025 ... David Anusontarangkul's Post. View profile for David Anusontarangkul. David Anusontarangkul. Freelance Full-Stack Developer. 1w. Report this ..."
"One of my students: ""I heard Next.js is slow."" Meanwhile, my team ...",https://www.linkedin.com/posts/robin-wieruch-971933a6_one-of-my-students-i-heard-nextjs-is-slow-activity-7376280453332373504-l-rx,"3 days ago ... One of my students: ""I heard Next.js is slow."" Meanwhile, my team and I are shipping a freelance ... Full Stack Developer | Next.js ..."
How do Colombians write emails compared to Germans? Having ...,https://www.linkedin.com/posts/christianjoecker_how-do-colombians-write-emails-compared-to-activity-7300784169813528576-qN6P,"Feb 26, 2025 ... Christian Jöcker's Post. View profile for Christian Jöcker · Christian Jöcker. Freelance Full-Stack Developer | IoT, AI, Web Apps | React, Node ..."
"FlutterConf LatAm happened in Quito, Ecuador this week. I delivered ...",https://www.linkedin.com/posts/puf_flutterconf-latam-happened-in-quito-ecuador-activity-7371944687357628416-sjWo,"Sep 11, 2025 ... Alexis Camué Hernández. Freelance Mobile Developer : Android, iOs, Flutter , Firebase, AWS, App Store Connect, Google Play Console, Git, etc."
How Upwork changed CocoLord to a noob on Fiverr | Mikko J ...,https://www.linkedin.com/posts/mikkor_freelancer-upwork-fiverr-activity-7199366000109051905-5tK9,"May 23, 2024 ... Esraa A. Freelance mobile app developer (Top Rated Mobile developer at UPWORK), I help you get Your Mobile App from Idea to the Market ..."
I'm tired of people treating AI like it's inevitable and so we all might ...,https://www.linkedin.com/posts/felix-angelov_im-tired-of-people-treating-ai-like-its-activity-7360032398283100161-fUZv,"Aug 9, 2025 ... Freelance Senior Web & Mobile Developer | Node.js, Flutter, React, Next.js, Firebase, Angular. 1mo. Report this comment; Close menu. Tbh, I don ..."
"The Hot Potato Process In many teams, the relationship between ...",https://www.linkedin.com/posts/lucaronin_the-hot-potato-process-in-many-teams-activity-7057624490804928512-INYj,"Apr 28, 2023 ... Freelance Front-End & Mobile Developer. 2y. Report this comment; Close menu. This workflow improves the process significantly for both sides ..."
#programming #coding #softwareengineering | Erik Andersen | 151 ...,https://www.linkedin.com/posts/ebandersen_programming-coding-softwareengineering-activity-7274453086989950978-BK4I,"Dec 16, 2024 ... When I was a mobile developer, I remember a backend developer ... Freelance Android Developer | Java | Kotlin | Passionate About Clean ..."
Who's read Doom Guy? Id's and Apogee's history are intimately tied ...,https://www.linkedin.com/posts/dukenukem_whos-read-doom-guy-ids-and-apogees-history-activity-7279163585014996992-iDbR,"Dec 29, 2024 ... Freelance Game Developer / Senior Mobile Developer at Cheq. 8mo. Report this comment; Close menu. I've read it twice, and now I want to read it ..."
"Excited to announce that I'm starting a new position as ""Engaged to ...",https://www.linkedin.com/posts/sharonsorin_excited-to-announce-that-im-starting-a-new-activity-7021467164477956097-EnE9?trk=public_profile_like_view,"Jan 18, 2023 ... Freelance Game Developer / Senior Mobile Developer at Cheq. 2y. Report this comment; Close menu. Congratulations! Like · Reply · 1 Reaction 2 ..."
Today is my last day at Google. I joined as an intern almost 18 years ...,https://www.linkedin.com/posts/romainguy_today-is-my-last-day-at-google-i-joined-activity-7302851015542804481-wx3g,"Mar 4, 2025 ... Android Engineer | Freelance | Mobile Developer | Software Craftsman. 6mo. Report this comment; Close menu. We'll meìiss you so much in the ..."
I've been using apps that I built myself with Claude AI I recorded 10+ ...,https://www.linkedin.com/posts/mengto_ive-been-using-apps-that-i-built-myself-activity-7268209344763060224-S9x5,"Nov 29, 2024 ... Freelance Mobile Developer : Android, iOs, Flutter , Firebase, AWS, App Store Connect, Google Play Console, Git, etc. 3w. Report this post"
"This week I had three planned podcast recordings, and I've used ...",https://www.linkedin.com/posts/james-spiro_this-week-i-had-three-planned-podcast-recordings-activity-7371053956342644736-422g,"Sep 8, 2025 ... Freelance Game Developer / Senior Mobile Developer at Cheq. 1w. Report this comment; Close menu. I feel the same way. I've never used any of the ..."
Last day at Apple! | Paolo Varani | 239 comments,https://www.linkedin.com/posts/paolovarani_last-day-at-apple-activity-7341748721392451585-c5dp,"Jun 20, 2025 ... ... Freelance iOS developer | Accessibility advocate | Speaker. 3mo. Report this comment; Close menu. Thanks for taking me with you on this ride - I ..."
My freelance rate is ~100 Euro per hour. I still here from so many ...,https://www.linkedin.com/posts/joe-wilhelm_my-freelance-rate-is-100-euro-per-hour-activity-7288535813934518272-m0GP,"Jan 24, 2025 ... My freelance rate is ~100 Euro per hour. I still ... Jeremiasz Grzesiuk. Building mobile apps | Team Leader | Senior Flutter & iOS developer."
Vincent Pradeilles ‍ posted on LinkedIn,https://www.linkedin.com/posts/vincentpradeilles_activity-7227207414700269569-wIR-,"Aug 8, 2024 ... iOS Developer | 4+ Years Experience | Swift | UIKit. 1y. Report this ... iOS/tvOS Freelance Developer @ Bouygues. 1y. Report this ..."
Just finished high school! I'm honoured to receive the Anthony ...,https://www.linkedin.com/posts/yumasoerianto_just-finished-high-school-im-honoured-activity-7269501024749387777-ul7d,"Dec 2, 2024 ... visionOS & iOS Developer • Apple WWDC Scholarship Winner. 9mo. Report ... Freelance iOS developer | Accessibility advocate | Speaker. 9mo."
"Tammo Freese passed away on December 30, 2024. I count myself ...",https://www.linkedin.com/posts/stefanmunz_tammo-freese-passed-away-on-december-30-activity-7283054162634760192-dItX,"Jan 9, 2025 ... Freelance iOS Developer at SRF - Schweizer Radio und Fernsehen. 8mo. Report this comment; Close menu. This is so hard to hear. How can life be ..."
How to handle memory leaks in iOS apps | Aleksa Simic posted on ...,https://www.linkedin.com/posts/aleksa-simic-10bba5182_ive-conducted-over-100-ios-interviews-so-activity-7361056373331173378-CZaD,"Aug 12, 2025 ... Freelance iOS Developer | App from sketch to release. 2w. Report this comment; Close menu. tha tah, young one. I remember the day. It was when ..."
#buildinpublic #flutterdev | Dario Digregorio | 12 comments,https://www.linkedin.com/posts/dario-digregorio-064696241_buildinpublic-flutterdev-activity-7283029821759098880-LxBq,"Jan 9, 2025 ... Freelance Flutter, React & iOS Developer | +10Y Experience | Founder of Sonuby Weather. 7mo. Report this comment; Close menu. Niiiice, looks ..."
#techweekchicago #inspiration #networking #wholesomemerch ...,https://www.linkedin.com/posts/huseinkareem_techweekchicago-inspiration-networking-activity-7222586314271907840-IbQh,"Jul 26, 2024 ... Full Stack Project Development Consulting | 3 x Founder | iOS Developer | Freelance Software Engineer | STE{A}M Educator | Priest. 1y. Report ..."
Xcode 26 Code Intelligence: A Game Changer for iOS Devs | Etisha ...,https://www.linkedin.com/posts/etisha-garg_xcode26-iosdevelopers-codeintelligence-activity-7338845162963353602-dLRA,"Jun 12, 2025 ... ... iOS developer, I had to try it. → Here is the Full Tutorial + ... Freelance iOS Dev. 1mo. Report this post; Close menu. How I Finally ..."
1 x Android & 1 x iOS (B2B) I have partnered with a client who ...,https://www.linkedin.com/posts/alex-bird-961643157_1-x-android-1-x-ios-b2b-i-have-partnered-activity-7346111682479333376-WDXy,"Jul 2, 2025 ... Senior iOS Developer | Swift, SwiftUI | Seeking Remote/Contract ... Freelance iOS Developer. 2mo. Report this comment; Close menu."
#contentcreator #buzzword #journey #tech #career #content ...,https://www.linkedin.com/posts/laura-oliveira-mobile_contentcreator-buzzword-journey-activity-7373847555304165376-ZvsT,"Sep 16, 2025 ... ... freelance projects and #fulltime opportunities with # ... Software Engineer | Mobile Engineer | Android Engineer | Android Developer ..."
This post is about how I ended up engaging with my first love after ...,https://www.linkedin.com/posts/indrajithek_this-post-is-about-how-i-ended-up-engaging-activity-7000341758907736064--Olj,"Nov 20, 2022 ... Freelance Android Developer | Educator. 2y. Report this comment; Close menu. I can relate to your story because it's quite closer to mine ..."
Many LinkedIn creators are just faking it and fooling their audiences ...,https://pg.linkedin.com/posts/pummi-marodia_many-linkedin-creators-are-just-faking-it-activity-7047891663477719040-wqQQ,"Apr 1, 2023 ... ""Freelance Android Developer | Java & Kotlin Expert | Partnering with Startups to Build Fast, Scalable & User-Centric Mobile Apps"". 2y. Report ..."
Dating is broken. Swipes. Ghosting. Algorithms that feel more ...,https://www.linkedin.com/posts/annabilych_dating-is-broken-swipes-ghosting-algorithms-activity-7372177156082339840-uJX_,"Sep 12, 2025 ... Florian M. Android Developer Freelance | I've created Lovzy, a mix of games and dating with a touch of AI. 1d. Report this comment; Close menu."
New Freelance role | Sam Wood,https://www.linkedin.com/posts/sam-wooddotnet_developer-freelance-android-activity-6950119158403543041-taZN,"Jul 5, 2022 ... New Freelance role Senior Android Developer FULLY REMOTE Foxtek's client is an Amsterdam-based scale-up that has a Saas platform ..."
Something is seriously wrong with Google Play Store's review ...,https://www.linkedin.com/posts/tdcolvin_something-is-seriously-wrong-with-google-activity-7236631552997093377-SMBr,"Sep 3, 2024 ... Senior Android Developer | Kotlin • Compose • MVVM • Flutter ... freelance Senior Software Developer (Android, Kotlin, Ktor, gen. AI) ..."
#event #meetings #opportunity #team #people #grateful ...,https://www.linkedin.com/posts/zoey-leigh-hendrickx-521320105_event-meetings-opportunity-activity-6995370988133613568-Kn41?trk=public_profile_like_view,"Nov 7, 2022 ... Freelance Android Developer (Kotlin). 2y. Report this comment; Close menu. Heel veel succes! Zet m op daar. Like · Reply · 1 Reaction 2 ..."
#programming #coding #softwareengineering | Erik Andersen | 151 ...,https://www.linkedin.com/posts/ebandersen_programming-coding-softwareengineering-activity-7274453086989950978-BK4I,"Dec 16, 2024 ... Freelance Android Developer | Java | Kotlin | Passionate About Clean Code and UI/UX. 3w. Report this post; Close menu. Diving into ..."
#competitiveprogramming #dsa #interviews #codingtest #internship ...,https://www.linkedin.com/posts/priyansh-agarwal_competitiveprogramming-dsa-interviews-activity-7045450824268820481-NKoo,"Mar 25, 2023 ... Student at Chandigarh University || Intern at Prodigy InfoTech || Android Developer ( Kotlin ) || Full Stack Web Developer (MERN) || Blockchain ..."
Offline workshop to personal meetup with so many friends. I am ...,https://www.linkedin.com/posts/hiteshchoudhary_offline-workshop-to-personal-meetup-with-activity-7213386255793836032-_xV4,"Jun 30, 2024 ... ... Android Developer | Full-Stack Developer | Educator at VIIT ... Freelance Technical Content Writer for IT Companies | Reliable ..."
#graphicdesign #whatsyourbudget #creativeindustry #freelance ...,https://www.linkedin.com/posts/davy-denduyver-a1b562139_graphicdesign-whatsyourbudget-creativeindustry-activity-7082643291749404672-jbpc?trk=public_profile_like_view,"Jul 6, 2023 ... ... freelance #merchandise | 10 comments on LinkedIn. ... SR QA Engineer. 2y. Report this comment; Close menu. Heerser! Like · Reply."
#curioustester #qaengineer #softwarequality | Hassan Maqsood | 10 ...,https://www.linkedin.com/posts/itshassan0000_curioustester-qaengineer-softwarequality-activity-7301269938327986176-Z_C-,"Feb 28, 2025 ... Freelance QA Engineer | Manual & Automation Testing | BDD with Gherkin | API & Mobile Testing | Playwright | Selenium | Appium | Python ..."
#upwork #freelance #gigeconomy #wfh | Anton Kuratnik,https://www.linkedin.com/posts/akuratnik_upwork-freelance-gigeconomy-activity-7189291283213901825-Ss6E,"Apr 25, 2024 ... ... Freelance #gigeconomy #WFH. ... QA Engineer | Project Management | Instructor | Upwork Freelancer. 1y."
My first freelance project as an SQA engineer | Kazi Maharaf Islam ...,https://www.linkedin.com/posts/kazi-maharaf-islam_website-testing-for-a-customer-activity-7214266595638935552-4QFK,"Jul 3, 2024 ... ... freelance project as an SQA engineer was a significant milestone ... Sumaiya Akhter Priya. Software QA Engineer || Manual Testing || API ..."
#lifeinqa #dayinthelife #softwaretesting #qarole #qualitymatters ...,https://www.linkedin.com/posts/kadiryapar_lifeinqa-dayinthelife-softwaretesting-activity-7323288519559249920-EPYe,"Apr 30, 2025 ... A Day in My Life as a QA Engineer When people ask me what I do as a QA engineer, I sometimes smile and say: “I help prevent headaches before ..."
#qa #automationtesting #sdet #selenium #remotework #freelance ...,https://www.linkedin.com/posts/yogita-paliwal-03aa20216_qa-automationtesting-sdet-activity-7299666970143072259-XqRv,"Feb 23, 2025 ... ... Freelance #ContractJobs #HiringNow Truelancer.com Dipesh Garg Shubham Agarwal. ... QA Engineer. 6mo. Report this comment; Close menu. Great ..."
