Title,URL,Snippet
Excited to announce that we are hiring at Eventual in San Francisco ...,https://www.linkedin.com/posts/ykdojo_excited-to-announce-that-we-are-hiring-at-activity-7373793177717178369-Msif,"Sep 16, 2025 ... Excited to announce that we are hiring at Eventual in San Francisco ... Developer Advocate ($150000 - $200000) - Product Designer ($120000 ..."
Excited to announce that we are hiring at Eventual in San Francisco ...,https://www.linkedin.com/posts/ykdojo_excited-to-announce-that-we-are-hiring-at-activity-7373793177717178369-Msif,"Sep 16, 2025 ... Excited to announce that we are hiring at Eventual in San Francisco! - Software Engineer, Product ($150000 - $250000) - Software Engineer, ..."
We're Hiring: BI Database Developer Location: U.S. | Pay ...,https://www.linkedin.com/posts/methodical-group_were-hiring-bi-database-developer-location-activity-7369388136163987457-Mfj_,"Sep 4, 2025 ... We're Hiring: BI Database Developer Location: U.S. | Pay: $82846.36 – $120000/year What if your next role wasn't just a job—but a chance ..."
We're Hiring: Full-Stack Developer | Todd Winship,https://www.linkedin.com/posts/toddwinship_were-hiring-full-stack-developer-activity-7373510859379240960-R8-9,"Sep 15, 2025 ... We're Hiring: Full-Stack Developer (Canada) At yPilot, we're transforming how banks and credit unions operate with secure, ..."
Hiring Full Stack Developer (1-3 Years Exp.) | Full-time | Remote ...,https://www.linkedin.com/posts/meet-siddharth_hiring-full-stack-developer-1-3-years-activity-7368607601825075201-sPKm,"Sep 2, 2025 ... Hiring Full Stack Developer (1-3 Years Exp.) | Full-time | Remote PartyHub (HQ: Denver, CO.) is looking for a Full-Stack Developer to help ..."
"HIRING ALERT! Azure Cloud Engineer | Chicago, IL (Onsite ...",https://www.linkedin.com/posts/judyannretuerma_hiring-alert-azure-cloud-engineer-chicago-activity-7369732497695232000-8oQd,"Sep 5, 2025 ... HIRING ALERT! Azure Cloud Engineer | Chicago, IL (Onsite) | Contract Responsibilities: - Architect and design Azure-first solutions, ..."
anyone looking for a super smart DS / research scientist? someone ...,https://www.linkedin.com/posts/nikhita-luthra-995632b9_anyone-looking-for-a-super-smart-ds-research-activity-7368789025572147201-Ja7l,"Sep 2, 2025 ... ... looking for a super smart DS / research scientist ... Data Engineer|Looking for roles in USA and Canada|Permanent Resident of Canada."
Job seekers outnumber openings: What's driving the shift? | Chase ...,https://www.linkedin.com/posts/chase-dawson-79b9b442_for-the-first-time-since-2021-job-seekers-activity-7369364618705571842--RiX,"Sep 4, 2025 ... Despite headlines about a slowdown, the U.S. labor market is showing resilience: 1 job opening for every unemployed person — a balanced, but ..."
Job seekers outnumber openings: What's driving the shift? | Chase ...,https://www.linkedin.com/posts/chase-dawson-79b9b442_for-the-first-time-since-2021-job-seekers-activity-7369364618705571842--RiX,"Sep 4, 2025 ... Systems & Network Engineer | Cloud Engineer ... Despite headlines about a slowdown, the U.S. labor market is showing resilience: 1 job opening ..."
"Staff Backend Engineer, Grafana Ops - IRM | Canada | Remote | Will ...",https://www.linkedin.com/posts/wcgallego_staff-backend-engineer-grafana-ops-irm-activity-7369371166744023042-vr8S,"Sep 4, 2025 ... Hey all, Grafana Labs has an open position on my team, IRM, building ... Come work with me! Staff Backend Engineer ..."
#sonatafyfamily #playwright #qa #tester #automation #hiring ...,https://www.linkedin.com/posts/sonatafy_sonatafyfamily-playwright-qa-activity-7373411054732722176-RZgN,"Sep 15, 2025 ... We are looking for a QA Engineer from Latin America to join our team. Check our open position and apply: https://hubs.la/Q03Jnf6x0 ..."
#hiring #vancouvertech #mobiledevelopment #fullstack ...,https://www.linkedin.com/posts/pixieset_hiring-vancouvertech-mobiledevelopment-activity-7371218365404676096-UlIh,"Sep 9, 2025 ... ... Mobile Developer to join our team. As part of the team, you'll: Build and maintain high-quality mobile apps (one already has a 5-star ..."
Join our team at Sonia (YC W24) in San Francisco! :) | Lukas Wolf,https://www.linkedin.com/posts/lukas-wo_join-our-team-at-sonia-yc-w24-in-san-francisco-activity-7371956557154181121-WILU,"Sep 11, 2025 ... Join our team at Sonia (YC W24) in San Francisco! : ... We're getting closer and are hiring a design engineer, AI engineer ..."
"The Misunderstood AI: Pros, Cons, and the Need for Understanding ...",https://www.linkedin.com/posts/jacobbillings_ai-is-a-buzz-word-its-often-not-what-people-activity-7371132715657678848-_Bf-,"Sep 9, 2025 ... ... AI Engineer | | Book of Mormon Researcher | Mesoamerican/Mesopotamian linguist ... You still need your judgment, reasoning, and creativity."
*****CONTRACT ROLE***** *****CONTRACT ROLE ...,https://www.linkedin.com/posts/dhamu-nambakam-1a57a3243_contract-role-contract-role-activity-7374449913306230784-X-ak,"Sep 18, 2025 ... CONTRACT ROLE***** *****CONTRACT ROLE***** *****CONTRACT ROLE***** Role : Oracle EBS Technical Developer Location : Seattle, ..."
"How to use AI to create value, not vanity, in your service business ...",https://www.linkedin.com/posts/petersena_200-million-people-asked-the-same-question-activity-7370803204583788544-9J9N,"Sep 8, 2025 ... 19yo Freelance Frontend Engineer | Design and code interfaces that are seamless and performant | Building reusable & scalable component ..."
A concept every Full Stack Engineer should know – Server-Driven ...,https://www.linkedin.com/posts/yangshun_a-concept-every-full-stack-engineer-should-activity-7373975709024780288-DIL9,"Sep 17, 2025 ... 19yo Freelance Frontend Engineer | Design and code interfaces that are seamless and performant | Building reusable & scalable component ..."
"Senior Director, Software Engineering | Sean Vassilaros",https://www.linkedin.com/posts/seanv_senior-director-software-engineering-activity-7370819306265190400-PuMe,"Sep 8, 2025 ... Remote role within North America. Apply here: [Link to Job Posting] ... Full Stack / Backend Software Engineer: https://lnkd.in/eHBAy_uN 2."
#hiring | Raja Saleru,https://www.linkedin.com/posts/raja-saleru-25007418_hiring-activity-7371185809036566529-70N8,"Sep 9, 2025 ... Job Title: DevOps Engineer Duration: 6 months+ Chicago, IL (Hybrid ... #Hiring - W2 or FTE only, 100% remote role Position: Technical ..."
From Zero to Data Engineer: Full Career Transition Guide | Ninad ...,https://www.linkedin.com/posts/ninad-magdum-11571410b_from-zero-to-data-engineer-full-career-transition-activity-7371799693158383617-MU3R,"Sep 11, 2025 ... ... remote role (USA) where you'll be leading security-focused data ... Data Engineer ..."
[Remote Job] Senior Full-stack Developer at Lemon.io | Working ...,https://www.linkedin.com/posts/working-nomads_remote-job-senior-full-stack-developer-activity-7374430775125118977-X8Xn,"Sep 18, 2025 ... New Remote Job Alert! [Full-time job - work from Europe,Latin America,North America,APAC,UK] Senior Full-stack Developer at Lemon.io ..."
"Staff Backend Engineer, Grafana Ops - IRM | Canada | Remote | Will ...",https://www.linkedin.com/posts/wcgallego_staff-backend-engineer-grafana-ops-irm-activity-7369371166744023042-vr8S,"Sep 4, 2025 ... Come work with me! Staff Backend Engineer, Grafana Ops - IRM | Canada | Remote job-boards.greenhouse.io."
[Remote Job] Senior Full-stack Developer at Lemon.io | Working ...,https://www.linkedin.com/posts/working-nomads_remote-job-senior-full-stack-developer-activity-7374430775125118977-X8Xn,"Sep 18, 2025 ... New Remote Job Alert! [Full-time job - work from Europe,Latin America,North America,APAC,UK] Senior Full-stack Developer at Lemon.io ..."
Nvidia's Revenue Reveals Two Mystery Customers' Dominance ...,https://www.linkedin.com/posts/jessie-addison-a1713b2ba_nvidia-technews-aihardware-activity-7368279670796009472-2ZCY,"Sep 1, 2025 ... ... Data Engineer- Anywhere-Remote Two ""Mystery"" Customers Account ... Looking for a remote job in Canada? We just dropped new roles ..."
Nvidia's revenue heavily reliant on two mystery customers | Jessie ...,https://www.linkedin.com/posts/jessie-addison-a1713b2ba_nvidia-technews-aihardware-activity-7368304140931772416-545C,"Sep 1, 2025 ... Quality Assurance Analyst -Remote Lead AI Engineer- Remote ... Looking for a remote job in Canada? We just dropped new roles ..."
