Title,URL,Snippet
"Hi Connections, We are looking for a QA Engineer - Manual Testing ...",https://www.linkedin.com/posts/sanduni-jayasinghe-b1bb28239_hi-connections-we-are-looking-for-a-qa-activity-7267758497797144576-q-wa,"Nov 27, 2024 ... We are looking for a QA Engineer - Manual Testing. This is an independent consultancy contract for a period of 06 months."
Are you a QA engineer/developer that is looking for a position? I'm ...,https://www.linkedin.com/posts/sebastian-schreuder_are-you-a-qa-engineerdeveloper-that-is-looking-activity-7369179178006401024-zHvD,"Sep 3, 2025 ... Are you a QA engineer/developer that is looking for a position? I'm searching for someone who has mobile development experience and testing."
"Good afternoon, I'm looking for QA engineer with qualities below 1 ...",https://www.linkedin.com/posts/olive-sweka-067437220_good-afternoon-im-looking-for-qa-engineer-activity-7315351763333603328-hIeh,"Apr 8, 2025 ... Good afternoon, I'm looking for QA engineer with qualities below 1. You should have two years experience of app testing. 2."
"Chrysantha is an incredible QA engineer, learns faster than just ...",https://www.linkedin.com/posts/chrisralder_chrysantha-is-an-incredible-qa-engineer-activity-7121692932016934912-fE6W?trk=public_profile_share_view,"Oct 21, 2023 ... Chrysantha is an incredible QA engineer, learns ... If anyone you know is looking for an excellent QA, would love to connect you with her."
"CHEQ Lifestyle technology Inc, a Seattle, Washington based tech ...",https://www.linkedin.com/posts/mizan_cheq-lifestyle-technology-inc-a-seattle-activity-7298364722427441154-uVQr,"Feb 20, 2025 ... QA engineer – Automation focused (2 person): We are looking for a QA engineer with 2-4 years of solid experience. You must have worked with ..."
I applied to 100 jobs daily as a DevOps engineer and got 10 job ...,https://www.linkedin.com/posts/praveen-singampalli_i-applied-to-100-jobs-daily-as-a-devops-engineer-activity-7236204706895683585-nx1Q,"Sep 1, 2024 ... I applied to 100 jobs daily as a DevOps engineer and got 10 job offers I started my job search in the month ... looking for job change with 14 ..."
We're looking for a part-time DevOps Engineer to join an AI-focused ...,https://www.linkedin.com/posts/imankhoraminezhad_were-looking-for-a-part-time-devops-engineer-activity-7333182025249566720-7cx9,"May 27, 2025 ... We're looking for a part-time DevOps Engineer to join an AI-focused startup. If you have solid experience in DevOps and are passionate about ..."
Forward is looking for a europe-based devops engineer ($400-$525 ...,https://www.linkedin.com/posts/peter-berg-nyc_forward-is-looking-for-a-europe-based-devops-activity-7305503571154817024-f765,"Mar 12, 2025 ... Forward is looking for a europe-based devops engineer ($400-$525/day) to help an nyc-based hypergrowth AI startup keep up with their ..."
This DevOps roadmap has helped me to crack JPMorganChase ...,https://www.linkedin.com/posts/praveen-singampalli_this-devops-roadmap-has-helped-me-to-crack-activity-7273001061735383040-e4S_,"Dec 12, 2024 ... ... DevOps Engineer Expert, or Google Cloud Certified DevOps Engineer to ... Actively looking for full time positions | Senior DevOps Engineer ..."
Looking for an Multicloud DevOps Engineer to join a funded start up ...,https://www.linkedin.com/posts/maryann-mcgee-570809144_looking-for-an-multicloud-devops-engineer-activity-7295750249547980800-aG1R,"Feb 13, 2025 ... Looking for an Multicloud DevOps Engineer to join a funded start up in the Cloud Space! Skillset- Multicloud DevOps (AWS, Azure, ..."
Interviewer : Build a Python script for log file monitoring and alerting ...,https://www.linkedin.com/posts/praveen-singampalli_interviewer-build-a-python-script-for-log-activity-7272448355148951552-dxx7,"Dec 10, 2024 ... ... looking for? 1) You should be a multi cloud engineer 2) You ... DevOps engineer : idk I am just a DevOps engineer. Interviewer : me ..."
My interview questions and experience with Atlassian | Praveen ...,https://www.linkedin.com/posts/praveen-singampalli_i-applied-toatlassian-as-a-devops-engineer-activity-7236576687449108482-ivWw,"Sep 2, 2024 ... I applied to Atlassian as a DevOps Engineer and these are my interview questions and experience ... looking for job change with 14 Real ..."
We're looking for a Senior DevOps Engineer with expertise in AWS ...,https://www.linkedin.com/posts/enfin-technologies_hiring-devops-kubernetes-activity-7303309818977492992-bxyQ,"Mar 5, 2025 ... We're looking for a Senior DevOps Engineer with expertise in AWS, GCP, Azure, Kubernetes, Terraform, and modern DevOps practices."
TrainWithShubham is all pumped up to present “Terraform In One ...,https://www.linkedin.com/posts/shubhamlondhe1996_trainwithshubham-is-all-pumped-up-to-present-activity-7306949523300352000-iO6O,"Mar 16, 2025 ... ... DevOps Engineer Happy Learning TrainWithShubham | 34 comments on LinkedIn. ... You are looking for me! Zealous DevOps Engineer championing ..."
Akij iBOS is currently looking for a talented DevOps Engineer Key ...,https://www.linkedin.com/posts/akijibos_akij-ibos-is-currently-looking-for-a-talented-activity-7267807664187809793-QOhK,"Nov 27, 2024 ... Akij iBOS is currently looking for a talented DevOps Engineer Key Responsibilities: *Design, implement, and manage cloud-based ..."
While looking for a senior data scientist/ML engineer position this ...,https://www.linkedin.com/posts/ilyamarkov_while-looking-for-a-senior-data-scientist-activity-7291043239661371394-BGgl,"Jan 31, 2025 ... While looking for a senior data scientist/ML engineer position this summer, I had many behavioral and technical interviews with such ..."
My team is looking for data scientist to work on challenging projects ...,https://www.linkedin.com/posts/saptarshiguha_my-team-is-looking-for-data-scientist-to-activity-7250347044853186560-I0hZ,"Oct 10, 2024 ... My team is looking for data scientist to work on challenging projects related to Apple Intelligence development. This work is at the ..."
We're hiring! We are looking for a Football Data Scientist to join our ...,https://www.linkedin.com/posts/davidpajonmoreno_were-hiring-we-are-looking-for-a-football-activity-7341167902588395522-oHrb,"Jun 18, 2025 ... We're hiring! We are looking for a Football Data Scientist to join our First Team analytics group. Shape the future of football with data ..."
Looking for Data Scientist Roles Perfect for Early-Career ...,https://www.linkedin.com/posts/arpitarawal_looking-for-data-scientist-roles-perfect-activity-7280217456843935744-xi8u,"Jan 1, 2025 ... Looking for Data Scientist Roles Perfect for Early-Career Professionals ? If you have 0-3 years of experience and are ready to kickstart ..."
Looking for a data scientist who finds rock climbing at great heights ...,https://www.linkedin.com/posts/seanhall-competitive-advantage-productivity-burnout-creativity-energy-mental-health-wellbeing_looking-for-a-data-scientist-who-finds-rock-activity-7219512017643036672-Oz08,"Jul 17, 2024 ... Hello….is it me you're looking for? (To be your team's next Data Scientist) ….'Cause I wonder where you are ⛰I'm in Squamish, BC …"
"Codebasics is looking for Data Scientist, AI/ML Engineer freelancers ...",https://www.linkedin.com/posts/dhavalsays_codebasics-is-looking-for-data-scientist-activity-7191277783870824448-GVxS,"Apr 30, 2024 ... Codebasics is looking for Data Scientist, AI/ML Engineer freelancers Who can help us build educational content for our YouTube channel and ..."
Our team is looking for a Data Scientist. You will be working on ...,https://www.linkedin.com/posts/johnyzhang_our-team-is-looking-for-a-data-scientist-activity-7254542605865111553-jV6f,"Oct 22, 2024 ... Our team is looking for a Data Scientist. You will be working on demand supply forecast, pricing, operational optimization, ..."
I'm looking for a Staff Data Scientist to join my team! | Qi Dong,https://www.linkedin.com/posts/ilhyvmvm_discord-staff-data-scientist-analytics-activity-7234646168129941504-d8ce,"Aug 28, 2024 ... I'm looking for a Staff Data Scientist to join my team! If you're interested in having a direct impact in driving user growth and enhancing ..."
anyone looking for a super smart DS / research scientist? someone ...,https://www.linkedin.com/posts/nikhita-luthra-995632b9_anyone-looking-for-a-super-smart-ds-research-activity-7368789025572147201-Ja7l,"Sep 2, 2025 ... Hey Nikhita - I'm a data scientist looking for my next role - can we connect? Like · Reply. 1 Reaction. See more comments. To view or add a ..."
"If you are looking for an impactful role as a data scientist, reach out ...",https://www.linkedin.com/posts/vivekpradeep_if-you-are-looking-for-an-impactful-role-activity-7372092333183606784-jfIG,"Sep 11, 2025 ... If you are looking for an impactful role as a data scientist, reach out to Justin Wagle - the work he and his team do help shape products ..."
While looking for a senior data scientist/ML engineer position this ...,https://www.linkedin.com/posts/ilyamarkov_while-looking-for-a-senior-data-scientist-activity-7291043239661371394-BGgl,"Jan 31, 2025 ... While looking for a senior data scientist/ML engineer position this ... Data Engineer | Python, SQL, ETL Pipelines | Data Visualization ..."
My team is looking for data scientist to work on challenging projects ...,https://www.linkedin.com/posts/saptarshiguha_my-team-is-looking-for-data-scientist-to-activity-7250347044853186560-I0hZ,"Oct 10, 2024 ... My team is looking for data scientist to work on challenging ... Hi, Saptarshi Guha I'm an experienced Data Engineer with 3+ years in ..."
AutoNation is looking for a Data Engineer to join our team! As a Data ...,https://www.linkedin.com/posts/autonation_autonation-is-looking-for-a-data-engineer-activity-6822936105181151232-Wmwm,"Jul 19, 2021 ... AutoNation is looking for a Data Engineer to join our team! As a Data Engineer, you will be responsible for providing operational and ..."
My interview experience with Walmart for Data Engineer III | D ...,https://www.linkedin.com/posts/santhosh-kumard_interview-experience-at-walmart-bangalore-activity-7307994385617432576-pFtb,"Mar 18, 2025 ... My interview experience with Walmart for Data Engineer III ... Aishwarya N. Actively Looking for Data Analyst Roles | Ex-HDFC | Python • SQL • ..."
Stop wasting time studying for AWS exam. | Madison Schott posted ...,https://www.linkedin.com/posts/schottmadison_stop-paying-to-take-an-exam-just-for-a-certificate-activity-7209616443926032386-FYwY,"Jun 20, 2024 ... Looking for Data Engineer | 2.7 X Masters (Information Technology, Business Analytics, Pathology) | Prepared healthcare dataset was ..."
Indo Premier Sekuritas is Hiring! We're looking for Data Engineer to ...,https://www.linkedin.com/posts/indo-premier-securities_indo-premier-sekuritas-is-hiring-were-looking-activity-7205794490505207810-bEVA,"Jun 9, 2024 ... Indo Premier Sekuritas is Hiring! We're looking for Data Engineer to join our team. Apply now: https://lnkd.in/gDX4tCTn."
My Interview Experience at Meta: Data Engineer Role | Divyashree ...,https://www.linkedin.com/posts/divyashree-iyer_my-interview-experience-at-meta-a-couple-activity-7343782686806667264-wslZ,"Jun 25, 2025 ... ... looking for in a data engineer. Loop Rounds There were three technical rounds and one behavioral. Each technical round started with a ..."
"We're looking for a Senior Data Engineer, based in our office in Aix ...",https://www.linkedin.com/posts/alpha10x_were-looking-for-a-senior-data-engineer-activity-7342890316133285888-UZjN,"Jun 23, 2025 ... We're looking for a Senior Data Engineer, based in our office in Aix-en-Provence, France About this role: ALPHA10X is the AI leader in ..."
Looking for a Data Engineer for one of my investment management ...,https://www.linkedin.com/posts/matt-stella-1b851b52_looking-for-a-data-engineer-for-one-of-my-activity-7188279291808284673-a54F,"Apr 22, 2024 ... Looking for a Data Engineer for one of my investment management clients in NYC. 4 Days onsite. $120-130k base +bonus . Looking for someone ..."
I'm looking for a analytics engineer / data analyst rock star to join my ...,https://www.linkedin.com/posts/vshastry_im-looking-for-a-analytics-engineer-data-activity-7293690307890528256-MtQ0,"Feb 7, 2025 ... I'm looking for a analytics engineer / data analyst rock star to join ... Data Engineer & Analyst | Python • SQL • AWS | ETL Pipelines ..."
While looking for a senior data scientist/ML engineer position this ...,https://www.linkedin.com/posts/ilyamarkov_while-looking-for-a-senior-data-scientist-activity-7291043239661371394-BGgl,"Jan 31, 2025 ... While looking for a senior data scientist/ML engineer position this summer, I had many behavioral and technical interviews with such ..."
We are looking for a seasoned ML engineer (5+ YoE) based in US ...,https://www.linkedin.com/posts/zariable_we-are-looking-for-a-seasoned-ml-engineer-activity-7117711855363518464-t40i?trk=public_profile_like_view,"Oct 10, 2023 ... We are looking for a seasoned ML engineer (5+ YoE) based in US to join our team in building ML solutions to drive user growth at Snap."
AIonOS is looking for AI/ML Engineer on contract for 3-6 months let ...,https://www.linkedin.com/posts/sneha-sharma-a6411442_aionos-is-looking-for-aiml-engineer-on-contract-activity-7217560082455150593-9oIc,"Jul 12, 2024 ... AIonOS is looking for AI/ML Engineer on contract for 3-6 months let me know if someone is looking for project and can start immediately."
I am looking for a ML Engineer with deep understanding of ...,https://www.linkedin.com/posts/hoodkhizer_i-am-looking-for-a-ml-engineer-with-deep-activity-7287838183499665409-0EcA,"Jan 22, 2025 ... I am looking for a ML Engineer with deep understanding of fundamentals. If you know someone, or believe you can be fit, please reach out."
I'm looking for an enthusiastic and dedicated ML Engineer Intern to ...,https://www.linkedin.com/posts/yinglan-ma_2024-aiml-intern-machine-learning-engineer-activity-7128569661352284160-Ii6G?trk=public_profile_like_view,"Nov 9, 2023 ... I'm looking for an enthusiastic and dedicated ML Engineer Intern to be part of our team for GenAI (LLM and LMM) initiatives."
NBIM is looking for yet another AI and ML Engineer! | FINN.no | Stian ...,https://www.linkedin.com/posts/stiank_nbim-is-looking-for-yet-another-ai-and-ml-activity-7326528910316167171-IKAD,"May 9, 2025 ... We're looking for a skilled AI & ML Engineer to join our mission of driving innovation across one of the world's largest funds."
"Codebasics is looking for Data Scientist, AI/ML Engineer freelancers ...",https://www.linkedin.com/posts/dhavalsays_codebasics-is-looking-for-data-scientist-activity-7191277783870824448-GVxS,"Apr 30, 2024 ... Codebasics is looking for Data Scientist, AI/ML Engineer freelancers Who can help us build educational content for our YouTube channel and ..."
Looking for a Senior ML engineer to join my data science team at ...,https://www.linkedin.com/posts/brunocoussement_generation-senior-machine-learning-engineer-activity-7256976205898248192-FKey,"Oct 29, 2024 ... Looking for a Senior ML engineer to join my data science team at Luminus! Here's 3 reasons why you should consider: 1️⃣ You will be working on ..."
I am excited to share that I am looking for two exceptional engineers ...,https://www.linkedin.com/posts/justin-vasquez-064465110_i-am-excited-to-share-that-i-am-looking-for-activity-7366494505807642625-KUeh,"Aug 27, 2025 ... ... looking for individuals with: 1. A strong technical background ... AI/ML Engineer | R&D Engineer at Caspia Technologies | Tech Lead at ..."
"Looking for an ML Engineer. At Kilona, we're hiring an ML Engineer ...",https://www.linkedin.com/posts/stepan-kudelia-6192431ab_looking-for-an-ml-engineer-at-kilona-were-activity-7305607047348195329-boaT,"Mar 12, 2025 ... Looking for an ML Engineer. At Kilona, we're hiring an ML Engineer. If you or someone you know is a great fit, let's talk."
While looking for a senior data scientist/ML engineer position this ...,https://www.linkedin.com/posts/ilyamarkov_while-looking-for-a-senior-data-scientist-activity-7291043239661371394-BGgl,"Jan 31, 2025 ... While looking for a senior data scientist/ML engineer position this ... AI Engineer, Python is out here doing everything — except maybe ..."
Hello network - AI Engineer looking for a job. Proficient with LLMs ...,https://www.linkedin.com/posts/jorge-gallego-feliciano-1a00611b3_hello-network-ai-engineer-looking-for-activity-7091134606007050240-czZf,"Jul 29, 2023 ... Hello network ✨ - AI Engineer looking for a job. Proficient with LLMs. Looking to start working in October in London."
Looking for a Personal AI Engineer / Agent Builder I'm looking for a ...,https://www.linkedin.com/posts/akinyemiju_looking-for-a-personal-ai-engineer-agent-activity-7324844515557543936-DQOd,"May 4, 2025 ... Looking for a Personal AI Engineer / Agent Builder I'm looking for a highly technical partner to help me design and build a personal AI ..."
"Hi Network, I'm looking for an AI Engineer to work on a contract ...",https://www.linkedin.com/posts/chaynandam1-74b782167_hi-network-im-looking-for-an-ai-engineer-activity-7300607092921356288-5L84,"Feb 26, 2025 ... Hi Network, I'm looking for an AI Engineer to work on a contract basis with an organization I know. The ideal candidate should have: ..."
I am hiring an AI engineer in the Bay area or willing to relocate. You ...,https://www.linkedin.com/posts/tiagoluchini_i-am-hiring-an-ai-engineer-in-the-bay-area-activity-7312988743529869313-FTtj,"Apr 1, 2025 ... ... looking for engineers who want to explore ... Exciting opportunity,You're looking for an AI Engineer in the Bay Area, a hub for innovation."
We at Synadia are looking for an AI Engineer. If you are interested in ...,https://www.linkedin.com/posts/derekcollison_we-at-synadia-are-looking-for-an-ai-engineer-activity-7373419682420281344-bOAE,"Sep 15, 2025 ... We at Synadia are looking for an AI Engineer. If you are interested in how intelligent connectivity and digital fluidity shape embodied AI ..."
Looking for an AI engineer at Zeron. | Sanket Sarkar,https://www.linkedin.com/posts/infosecsanket_hiring-aiengineer-activity-7334809536333004801-BRpG,"May 31, 2025 ... Looking for an AI engineer at Zeron. Experience in cybersecurity is a plus. Inbox me if you are interested. #hiring #aiengineer."
"We, Fellows Fund, is looking for an AI engineer like this as well. We ...",https://www.linkedin.com/posts/alexchengmingren_we-fellows-fund-is-looking-for-an-ai-engineer-activity-7342306471239421952-t5-9,"Jun 21, 2025 ... We, Fellows Fund, is looking for an AI engineer like this as well. We aim to automate all the work of our fund operation! BTW, we like interns too!"
Looking for amazing engineers in Bangalore to hire (backend ...,https://www.linkedin.com/posts/amit-prakash-50719a2_looking-for-amazing-engineers-in-bangalore-activity-7265017822597062656-_R1Q,"Nov 20, 2024 ... Looking for amazing engineers in Bangalore to hire (backend, frontend, full-stack, AI engineer all needed). For the last 12 years, ..."
Misba S. was looking for events in the US. I tried Bhindi AI and ...,https://www.linkedin.com/posts/rohan-k-2502_misba-s-was-looking-for-events-in-the-us-activity-7330928182545612800-vuMA,"May 21, 2025 ... Close menu. Misba S. was looking for events in the US. I tried ... Student at SSIU'25 | Aspiring DevRel & AI Engineer | Building ..."
Spotter is hiring a prompt engineer. | Paul Bakaus posted on the ...,https://www.linkedin.com/posts/paulbakaus_tldr-were-hiring-our-first-ever-prompt-activity-7194518540681424896-fIWY,"May 9, 2024 ... ... looking for our first full time prompt engineer. If you're intensely curious and creative, consider yourself a world class question asker ..."
Flipside AI is looking for STEM Prompt Engineers and AI Prompt ...,https://www.linkedin.com/posts/flipside-digital-content-company-inc._flipside-ai-is-looking-for-stem-prompt-engineers-activity-7280416373648801792-2ITE,"Jan 1, 2025 ... Flipside AI is looking for STEM Prompt Engineers and AI Prompt ... Prompt Engineer | Social Media Evaluator | Data Annotator | Translator."
"The term ""prompt engineer"" makes me laugh. Mostly because I'm an ...",https://www.linkedin.com/posts/jamesrose0_the-term-prompt-engineer-makes-me-laugh-activity-7280722770986971136-EXz0,"Jan 2, 2025 ... The term ""prompt engineer"" makes me laugh. Mostly because I'm an ... looking for doesn't make you an engineer. At most, it may warrant ..."
"Welp, I'm looking for a new position. I'm tired of the corruption ...",https://www.linkedin.com/posts/adam-m-zarnowski_welp-im-looking-for-a-new-position-i-activity-7189442966598365184-YCDv,"Apr 25, 2024 ... Gooden, M.S.. Strategic Intelligence, AI/ML, & Public Affairs Consultant | Context Engineer/ Prompt Engineer | AI Integration (LLMs) | Master ..."
Looking to Hire an AI Prompt Engineer | Daniyal Chaudhry posted ...,https://www.linkedin.com/posts/daniyalfaridchaudhry_looking-to-hire-an-ai-prompt-engineer-location-activity-7349091811530846210-0gwl,"Jul 10, 2025 ... Looking to Hire an AI Prompt Engineer Location: Remote (Pakistan) ... looking for the one who dreams in prompts, builds multi-step logic ..."
Why can't AI generate good copy (anymore)? | Palkush Chawla ...,https://www.linkedin.com/posts/palkush_why-cant-ai-generate-good-copy-anymore-activity-7211715302114410496-_s20,"Jun 26, 2024 ... Bazil Hulmani. Actively looking for a New Role as a Copywriter or Prompt Engineer. 1y. Report this comment; Close menu. Did you know this thing ..."
AI Prompt Engineer & Creative Designer We're looking for a hybrid ...,https://www.linkedin.com/posts/khazanay_khazanay-is-hiring-ai-prompt-engineer-activity-7374328205580595200-X14_,"Sep 17, 2025 ... Khazanay is Hiring: AI Prompt Engineer & Creative Designer We're looking for a hybrid creative professional who can blend the power of AI ..."
I'm looking for some advice! I used to be a very polarized thinker ...,https://www.linkedin.com/posts/tzivia-cohen_im-looking-for-some-advice-i-used-to-activity-7289717122899865600-xq8A,"Jan 27, 2025 ... I'm looking for some advice! I ... Yehoshua King. AI Agents, Business Process Automation, Conversational AI | AI Pioneer | Prompt Engineer ..."
The rise of AI Engineering. | Aurimas Griciūnas,https://www.linkedin.com/posts/aurimas-griciunas_ai-llm-machinelearning-activity-7285974090966863873-hXed,"Jan 17, 2025 ... ... Prompt Engineer"" as their current title. The talent you're looking for might be the curious data scientist on your team, eager to level up."
Built a Tone-of-Voice GPT for Pylon | Marty Kausas posted on the ...,https://www.linkedin.com/posts/martykausas_i-should-not-be-sharing-this-but-i-built-activity-7326667311069691904-UMfn,"May 9, 2025 ... ... looking for. So as I was trying to describe what I was looking for in a Google Doc to a candidate, I decided to prompt engineer my way out of"
"Just received my copy of ""AI Engineering"" by Chip Huyen! I read the ...",https://www.linkedin.com/posts/maxime-labonne_just-received-my-copy-of-ai-engineering-activity-7285300641835413505-6gac,"Jan 15, 2025 ... ... be interested in if you're looking for more theory compared to our LLM Engineer's Handbook. | 16 comments on LinkedIn."
Hello network - AI Engineer looking for a job. Proficient with LLMs ...,https://www.linkedin.com/posts/jorge-gallego-feliciano-1a00611b3_hello-network-ai-engineer-looking-for-activity-7091134606007050240-czZf,"Jul 29, 2023 ... Gen AI - LLM Engineer. 2y Edited. Report this post; Close menu. ✨ Hello network ✨ - AI Engineer looking for a job. Proficient with LLMs ..."
We're Hiring: LLM Engineer | Yoav Einav,https://www.linkedin.com/posts/yoav-einav_were-hiring-llm-engineer-were-looking-activity-7338525532722020352-3FWi,"Jun 11, 2025 ... We're Hiring: LLM Engineer We're looking for an LLM Engineer to help us build, optimize, and scale Guidde 2.0, as I like to call it, ..."
Hiring Alert! I am looking for talented AI Engineers at VerbaFlo.AI's ...,https://www.linkedin.com/posts/ashish-dogra-22510911a_hiring-alert-i-am-looking-for-talented-activity-7296612030596227072-QMM5,"Feb 15, 2025 ... Hiring Alert! I am looking for talented AI Engineers at VerbaFlo.AI's AI R&D division ... Data Scientist | LLM Engineer | OxML 24 Participant | ..."
استخدام NLP/LLM Engineer در گروه MCI NEXT | Mohammadtaha ...,https://www.linkedin.com/posts/mohammadtaha-bagherifard_%D8%A7%D8%B3%D8%AA%D8%AE%D8%AF%D8%A7%D9%85-nlpllm-engineer-%D8%AF%D8%B1-%DA%AF%D8%B1%D9%88%D9%87-mci-next-activity-7363846473970601984-Chkn,"Aug 20, 2025 ... We're looking for a talented NLP/LLM Engineer with expertise in prompt engineering, ⚡ model training, and chatbot evaluation to help ..."
#machinelearning #artificialintelligence #generativeai | Paul Iusztin ...,https://www.linkedin.com/posts/pauliusztin_machinelearning-artificialintelligence-activity-7261686755064483840-iFzz,"Nov 11, 2024 ... My copy of the LLM Engineer's Handbook is finally here! It's ... looking for a place to learn how to build production-ready LLM & RAG ..."
Built LLM prototype from handbook by Iusztin and Labonne ...,https://www.linkedin.com/posts/siddharth-parmar-a901a075_just-finished-llm-engineers-handbook-by-activity-7321225660784418816-uJwq,"Apr 24, 2025 ... Just finished LLM Engineer's Handbook by Paul Iusztin and ... looking for a practical, hands-on roadmap to building and delivering ..."
We are hiring a few full-time software engineer positions at various ...,https://www.linkedin.com/posts/terrytangyuan_we-are-hiring-a-few-full-time-software-engineer-activity-7253061572665778179-muFk,"Oct 18, 2024 ... AI Lead Engineer @Nebulai Generative AI & LLM Engineer | RAG ... Actively Looking for Full-Time opportunities | Software Developer | CS-Grad@UNT."
