Title,URL,Snippet
"Senior Software Engineer, Developer Tools, Core | Sarah Drasner ...",https://www.linkedin.com/posts/sarahdrasner_senior-software-engineer-developer-tools-activity-7318993086771011585-1X8Y,"Apr 18, 2025 ... Hey all, we are hiring at Google on my team in Core- if you ... Senior Software Engineer, Developer Tools, Core google.com."
WE ARE HIRING A BUSINESS DEVELOPER ! If you are looking for ...,https://www.linkedin.com/posts/stockly_we-are-hiring-a-business-developer-activity-7284932871637614592-DfDd,"Jan 14, 2025 ... WE ARE HIRING A BUSINESS DEVELOPER ! If you are looking for a job to learn about negotiating, closing deals and how e-commerce works you ..."
We Are Hiring: Software Developer Interns! 15 Positions Open ...,https://www.linkedin.com/posts/probuddysoftware_we-are-hiring-software-developer-interns-activity-7320761472790196224-KEXh,"Apr 23, 2025 ... We Are Hiring: Software Developer Interns! 15 Positions Open | Work-from-Office | Stipend: ₹10000/month Location: ProBuddy Software ..."
We are hiring “Oracle APEX Developer” as per the below criteria ...,https://www.linkedin.com/posts/arrowdigitaltransformation_we-are-hiring-oracle-apex-developer-as-activity-7305237141314297857-wC4t,"Mar 11, 2025 ... We are hiring “Oracle APEX Developer” as per the below criteria; - Job Qualifications & Skills: • Bachelor's degree in computer science, Information Technology ..."
We are hiring Business Developer at DiveBridge | Bilal Umrani,https://www.linkedin.com/posts/bilalkumrani_we-are-hiring-business-developer-at-divebridge-activity-7318247471984345089-IbvK,"Apr 16, 2025 ... We are hiring Business Developer at DiveBridge · View organization page for DiveBridge · DiveBridge. 1,061 followers. 3mo Edited. Business ..."
We are hiring! The Las Vegas Raiders are looking for a Software ...,https://www.linkedin.com/posts/lasvegas-raiders_we-are-hiring-the-las-vegas-raiders-are-activity-7310096994402738176-xo-y,"Mar 24, 2025 ... We are hiring! The Las Vegas Raiders are looking for a Software Developer to develop and maintain customized software to support the ..."
We are hiring for an exciting new project in Abu Dhabi location ...,https://www.linkedin.com/posts/arvin-janbakhsh_we-are-hiring-for-an-exciting-new-project-activity-7360970124998197249-BBo9,"Aug 12, 2025 ... We are hiring for an exciting new project in Abu Dhabi location: - Backend Developer (Java) X3 - Product Manager - QA Engineer - Full-stack ..."
We are Hiring Medical Coder's Digital Forensic Investigator's Java ...,https://www.linkedin.com/posts/smartclues-technologies-llp_we-are-hiring-medical-coders-digital-activity-7236808911410839555-fILv,"Sep 3, 2024 ... We are Hiring Medical Coder's Digital Forensic Investigator's Java Developer's Android Developer's UI, UX Developer's | 210 comments on ..."
We are hiring a full stack developer intern! | Nabeel Sharif,https://www.linkedin.com/posts/nabeel-sharif-42170a141_we-are-hiring-a-full-stack-developer-intern-activity-7188589986131103745-eWYD,"Apr 23, 2024 ... We are hiring a full stack developer intern! More details here: https://lnkd.in/e7uXK3pN."
We are Hiring: Flutter Developer Salary Range: KES 63k – 100k ...,https://www.linkedin.com/posts/derrick-bundi_we-are-hiring-flutter-developer-salary-activity-7327563988932673537-a_WO,"May 11, 2025 ... We are Hiring: Flutter Developer Salary Range: KES 63k – 100k First Phase of the Hiring Process: 1/ Download Pretium Finance mobile ..."
We are hiring a few full-time software engineer positions at various ...,https://www.linkedin.com/posts/terrytangyuan_we-are-hiring-a-few-full-time-software-engineer-activity-7253061572665778179-muFk,"Oct 18, 2024 ... Senior Principal Software Engineer at Red Hat AI | Open Source Leader | Keynote Speaker | Author | Technical Advisor | We are hiring! 11mo ..."
WE ARE HIRING SOFTWARE ENGINEER INTERNS! If you are ...,https://www.linkedin.com/posts/stockly_we-are-hiring-software-engineer-interns-activity-7269373878689320961--wjN,"Dec 2, 2024 ... WE ARE HIRING SOFTWARE ENGINEER INTERNS! If you are looking for an internship to learn about Rust and strengthen your coding skills you ..."
Excited to announce that we are hiring at Eventual in San Francisco ...,https://www.linkedin.com/posts/ykdojo_excited-to-announce-that-we-are-hiring-at-activity-7373793177717178369-Msif,"Sep 16, 2025 ... Excited to announce that we are hiring at Eventual in San Francisco! - Software Engineer, Product ($150000 - $250000) - Software Engineer, ..."
"Senior Software Engineer, Developer Tools, Core | Sarah Drasner ...",https://www.linkedin.com/posts/sarahdrasner_senior-software-engineer-developer-tools-activity-7318993086771011585-1X8Y,"Apr 18, 2025 ... Hey all, we are hiring at Google on my team in Core- if you ... Senior Software ..."
We are hiring! We are seeking a Senior Software Engineer to join ...,https://www.linkedin.com/posts/flatironssolutions_we-are-hiring-we-are-seeking-a-senior-activity-7374064911297155072-N7fw,"Sep 17, 2025 ... We are hiring! We are seeking a Senior Software Engineer to join our product team in Boulder, CO. This position is focused on product ..."
Otter.ai is Hiring!! We are looking for talented Software Engineer ...,https://www.linkedin.com/posts/qy-chen_otterai-is-hiring-we-are-looking-activity-7343342749988900875-AxQB,"Jun 24, 2025 ... We are hiring!! 3mo. Report this post; Close menu. Otter.ai is Hiring!! We are looking for talented Software Engineer, Devops Intern to ..."
"Software Engineer, Google Cloud Web3 | James Tromans",https://www.linkedin.com/posts/jtromans_software-engineer-google-cloud-web3-activity-7338234079571505152-3GDi,"Jun 10, 2025 ... I'm excited to share that we are hiring Software Engineers in Sunnyvale, California ... Software Engineer ..."
WE ARE HIRING! Frontend Software Engineer (Flutter & React) We ...,https://www.linkedin.com/posts/techsavanna_we-are-hiring-frontend-software-engineer-activity-7224767941727158273-9mkm,"Aug 1, 2024 ... WE ARE HIRING! Frontend Software Engineer (Flutter & React) We are looking for a qualified Front-end developer to join our IT team."
We are #hiring for Senior Software Engineer/Principal Software ...,https://www.linkedin.com/posts/anunaytiwari_senior-software-development-engineer-in-redmond-activity-7224491490532548609-vvjG,"Jul 31, 2024 ... We are #hiring for Senior Software Engineer/Principal Software Engineer to join the Microsoft Fabric OneLake team. We have multiple openings ..."
We are hiring Sr. | Karthikeyan Natarajan,https://www.linkedin.com/posts/karthikeyan1987_uber-sites-activity-7295876221949681665-Ip-Q,"Feb 13, 2025 ... We are hiring Sr. Software Engineer (l5) and Software engineers (l4) across the Data Ingestion and Data Sharing teams."
We are hiring a cracked backend engineer to build a category ...,https://www.linkedin.com/posts/timon-zimmermann_we-are-hiring-a-cracked-backend-engineer-activity-7297908255937167360-6x91,"Feb 19, 2025 ... We are hiring a cracked backend engineer to build a category leader product. Must be exceptional at: → Systems design (distributed infra, ..."
Last week I got to spend some quality time with our Bangalore team ...,https://www.linkedin.com/posts/lakehouse_last-week-i-got-to-spend-some-quality-time-activity-7195791178083024898-NWk_,"May 13, 2024 ... ... we are hiring: 1. Product Manager 2. Engineering Manager 3. Data Platform Engineer 4. Data Infrastructure Engineer 5. Backend Engineer 6 ..."
"Hi, we are hiring! - Backend Engineer - Frontend Engineer - Tech ...",https://www.linkedin.com/posts/ervan-adetya-sukianto-a1973a61_hi-we-are-hiring-backend-engineer-frontend-activity-7155507347010797568-43Bn,"Jan 23, 2024 ... Hi, we are hiring! - Backend Engineer - Frontend Engineer - Tech lead - Etc Check out more at Makro PRO."
"We are hiring: 🛠️ Python Backend Engineer (Django, Databases ...",https://www.linkedin.com/posts/amol-walunj-386539112_we-are-hiring-python-backend-engineer-activity-7317965750449651712-RMA0,"Apr 15, 2025 ... We are hiring: 🛠️ Python Backend Engineer (Django, Databases, AWS) Please note: This is not a Data Scientist / AI engineer role."
"We are hiring for two new positions at Sensity! | Giorgio Patrini, PhD",https://www.linkedin.com/posts/giorgiopatrini_senior-backend-engineer-at-sensity-amsterdam-activity-7300489772085444608-_2f4,"Feb 26, 2025 ... We are hiring for two new positions at Sensity! Senior Backend Engineer (Cloud) https://lnkd.in/gaUXN4rh Senior Backend Engineer (On Premise ..."
We are hiring! | Smriti Joshi,https://www.linkedin.com/posts/smritisjoshi_staff-backend-engineer-nodejs-typescript-activity-7350741886279565312-M8D6,"Jul 14, 2025 ... ... We are hiring for a Staff Backend Engineer with strong experience in Node.js and TypeScript At Celonis, you will work on scalable backend ..."
We are hiring in Growth at PandaDoc! | PandaDoc,https://www.linkedin.com/posts/pandadoc_hiring-growthengineering-backend-activity-7335938393043873793-5OgT,"Jun 4, 2025 ... We are hiring in Growth at PandaDoc! We build fast, learn even ... Backend Engineer. Help evolve our monetisation strategy and drive ..."
We are a rapidly growing tech start-up in downtown Manhattan. | Will ...,https://www.linkedin.com/posts/will-hu-7474b6a3_careers-flagler-notion-activity-7229859342219366401-dwj2,"Aug 15, 2024 ... ... backend engineer to join our team to help build the AI ... Co-Founder of Flagler Health | We are hiring! 11mo. Report this post"
Staff Software Engineer | Zhimin Zong,https://www.linkedin.com/posts/zzong_staff-software-engineer-activity-7267288938011152384-hcd1,"Nov 26, 2024 ... We Are Hiring! - Sr. Go Backend Developer • 4 pages 4 pages ... Senior Backend Engineer, UK https://lnkd.in/gZUj74he What will you be ..."
We are hiring! Join our team! | Paola Scampini,https://www.linkedin.com/posts/paolascampini_we-are-hiring-join-our-team-activity-7289981288176885760-T5Nz,"Jan 28, 2025 ... ... Backend Engineer (Data Science) Backend Engineer (Data Platform) Senior Product Designer Product Manager Are we a match? Apply and ..."
We are hiring a Frontend-leaning Product Engineer at Granola ...,https://www.linkedin.com/posts/tikhonbelousko_we-are-hiring-a-frontend-leaning-product-activity-7308533566479425536-h7s2,"Mar 20, 2025 ... We are hiring a Frontend-leaning Product Engineer at Granola ... 19yo Freelance Frontend Engineer | Design and code interfaces that ..."
New role open! We are hiring for a Senior Frontend Engineer. What ...,https://www.linkedin.com/posts/bigeye-data_new-role-open-we-are-hiring-for-a-senior-activity-7330603556225331204-vSkp,"May 20, 2025 ... We are hiring for a Senior Frontend Engineer. What we're looking for: - 5+ years of experience in Frontend technologies - Experience designing, building, and ..."
"Hi, we are hiring! - Backend Engineer - Frontend Engineer - Tech ...",https://www.linkedin.com/posts/ervan-adetya-sukianto-a1973a61_hi-we-are-hiring-backend-engineer-frontend-activity-7155507347010797568-43Bn,"Jan 23, 2024 ... Hi, we are hiring! - Backend Engineer - Frontend Engineer - Tech lead - Etc Check out more at Makro PRO."
Last week I got to spend some quality time with our Bangalore team ...,https://www.linkedin.com/posts/lakehouse_last-week-i-got-to-spend-some-quality-time-activity-7195791178083024898-NWk_,"May 13, 2024 ... ... we are hiring: 1. Product Manager 2. Engineering Manager 3. Data ... Frontend Engineer 7. Solutions Engineer Apply here https://lnkd ..."
We are hiring!! | KubeNine | 98 comments,https://www.linkedin.com/posts/kubeops-consulting_we-are-hiring-activity-7215613371461578752-7om0,"Jul 7, 2024 ... We are hiring for the following roles: Senior DevOps Engineer (Full-time) Senior Frontend Engineer (Full-time) Senior Frontend Engineer ..."
We are hiring Frontend Engineer (React) Location: Remotly ...,https://www.linkedin.com/posts/arksentry_we-are-hiring-frontend-engineer-react-activity-7196497645048066049-3hjF,"May 15, 2024 ... We are hiring Frontend Engineer (React) Location: Remotly Company: ArkSentry Position Overview: We are seeking a talented Frontend Engineer ..."
WE ARE HIRING As Neko grows we are looking for a detail-oriented ...,https://www.linkedin.com/posts/d-matthews_we-are-hiring-as-neko-grows-activity-7293305092458340352-sesI,"Feb 6, 2025 ... WE ARE HIRING ✨ As Neko grows we are looking for a detail-oriented Frontend Engineer to bring our designs to life and craft seamless user ..."
We are hiring talented AI-native engineers at Third Chair (YC X25 ...,https://www.linkedin.com/posts/yoav-zimmerman-05653252_we-are-hiring-talented-ai-native-engineers-activity-7358164871277895682-_8Tp,"Aug 4, 2025 ... We are hiring talented AI-native engineers at Third Chair (YC X25) ... Satyark S. Frontend Engineer | web3 | DeFi | Deloitte Digital. 1mo."
#payglocal #react #nextjs #frontend #fintech #hiring #engineering ...,https://www.linkedin.com/posts/mohit01_payglocal-react-nextjs-activity-7369643433923117060-PHiN,"Sep 5, 2025 ... We're hiring: Frontend Engineer ... We are hiring for multiple roles across experience levels (0-8 years) ..."
Insuretech Unicorn are hiring | Ben Cook,https://www.linkedin.com/posts/ben-cook-fruition_softwareengineers-software-itcareers-activity-7351622289622241280-olOm,"Jul 17, 2025 ... Insuretech Unicorn are hiring We are hiring multiple roles in ... Frontend Engineer London (Max 1x per week) Up to £80k + Bonus + ..."
We are hiring for a full stack engineering role. | Garvit Goel,https://www.linkedin.com/posts/garvitgoel_we-are-hiring-for-a-full-stack-engineering-activity-7306916556221882368-nfZb,"Mar 15, 2025 ... We are hiring for ... Passionate Developer | Full Stack Developer Intern @ AIVID Techvision - Summer 2025 | Student at Ahmedabad University."
We are hiring a Full-Stack Developer Intern for our AI education ...,https://www.linkedin.com/posts/dror-margalit_we-are-hiring-a-full-stack-developer-intern-activity-7283257619685814272-LMjS,"Jan 9, 2025 ... We are hiring a Full-Stack Developer Intern for our AI education startup! We are seeking a Full-Stack Developer Intern who is passionate ..."
We are hiring a full stack developer intern! | Nabeel Sharif,https://www.linkedin.com/posts/nabeel-sharif-42170a141_we-are-hiring-a-full-stack-developer-intern-activity-7188589986131103745-eWYD,"Apr 23, 2024 ... We are hiring a full stack developer intern! More details here: https://lnkd.in/e7uXK3pN."
We are Hiring Full Stack Developer 4+ year experience We are ...,https://www.linkedin.com/posts/manishkumarshukla_we-are-hiring-full-stack-developer-4-year-activity-7275778419328454657-JRZY,"Dec 19, 2024 ... We are Hiring Full Stack Developer 4+ year experience We are looking for a Full Stack Developer to produce scalable software solutions."
We are hiring cracked engineers for Linkrunner.io Role: Founding ...,https://www.linkedin.com/posts/darshil-rathod_we-are-hiring-cracked-engineers-for-linkrunnerio-activity-7318534264818425857-_AJd,"Apr 17, 2025 ... Building Linkrunner.io | Founding Team @Bluelearn | Full Stack Developer. 5mo. Report this post; Close menu. We are hiring cracked engineers for ..."
WE ARE HIRING! - Full-stack Developer ( Java & Angular ) l 3+ ...,https://www.linkedin.com/posts/youssef-afifi-847906b2_we-are-hiring-full-stack-developer-activity-7304477687878721536-FMx7,"Mar 9, 2025 ... WE ARE HIRING! - Full-stack Developer ( Java & Angular ) l 3+ years of experience. - Sales Account Manager l 3+ years of experience."
We are hiring for an exciting new project in Abu Dhabi location ...,https://www.linkedin.com/posts/arvin-janbakhsh_we-are-hiring-for-an-exciting-new-project-activity-7360970124998197249-BBo9,"Aug 12, 2025 ... We are hiring for an exciting new project in Abu Dhabi ... Full-stack Developer (Java/React) If you could be interested, please ..."
We are hiring! Full stack developer Job description: Having the ...,https://www.linkedin.com/posts/nitx_we-are-hiring-full-stack-developer-job-activity-7200967474740113408--Gto,"May 27, 2024 ... We are hiring! Full stack developer Job description: Having the fundamental of the following stacks: -React -Laravel ,PHP -HTML,CSS,JS -Ajax ..."
We are hiring a Full Stack Developer! Are you passionate about ...,https://www.linkedin.com/posts/yunuse_we-are-hiring-a-full-stack-developer-activity-7163090895725027328-vxPS,"Feb 13, 2024 ... We are hiring a Full Stack Developer! Are you passionate about leveraging technology to make a meaningful impact on society?"
We Are Hiring ! POSITION: Sr. Full-stack Developer (Node.js & Vue ...,https://www.linkedin.com/posts/devnagriai_we-are-hiring-position-sr-full-stack-activity-7290977759353315328-U-q9,"Jan 30, 2025 ... We Are Hiring ! POSITION: Sr. Full-stack Developer (Node.js & Vue.js) Job Type: Full time, Work From Office (5 days) Location: Sector 16A, ..."
"We are hiring "" flutter Developer"" Job Responsibilities: •Develop and ...",https://www.linkedin.com/posts/sohaila-mamdoh-b4301b244_we-are-hiring-flutter-developer-job-responsibilities-activity-7326935568045522944-8YU_,"May 10, 2025 ... We are hiring "" flutter Developer"" Job Responsibilities ... Software engineer/Mobile developer/flutter developer. 4mo. Report this ..."
Hiring Interns for MENRV.AI We are hiring for following 5 roles: 1 ...,https://www.linkedin.com/posts/menrvatech_hiring-interns-for-menrvai-we-are-hiring-activity-7326506128010280960-aQIK,"May 9, 2025 ... We are hiring for following 5 roles: 1. Business Development & Sales 2. Mobile Developer for Android & iOS 3. Frontend Developer 3. Digital Marketing 5. Data ..."
Hi All... | Trimegah Sekuritas Indonesia,https://www.linkedin.com/posts/trimegah-securities_hi-all-we-are-hiring-mobile-developer-activity-7336336634231042048-Dr_q,"Jun 5, 2025 ... Hi All... We Are Hiring!! Mobile Developer Android (6 Months Contract) Job Description: · Design, develop, and maintain native Android ..."
"We are hiring Hailer, a pan-African mobility platform is hiring ...",https://www.linkedin.com/posts/maduna-malvin-nkomo-b275295_we-are-hiring-hailer-a-pan-african-mobility-activity-6656905506952658944-lsdk,"Apr 17, 2020 ... We are hiring Hailer, a pan-African mobility platform is hiring ... Mobile Developer (Android and iOS) Start Date: Immediately or at ..."
We Are Hiring! | Grape Technologies (Pvt.) Ltd. | 12 comments,https://www.linkedin.com/posts/grapetechnologiespvtltd_we-are-hiring-activity-7196858697107550208-10o4,"May 16, 2024 ... We Are Hiring! | 12 comments on LinkedIn. ... Mobile Developer | UI/UX Designer | HTML, CSS, JavaScript | Dart ..."
"Full Time: - Mobile Developer (iOS, Android) | Vikas Kumar",https://www.linkedin.com/posts/vikas-kumar-aaa5a518_uscitizen-gc-ead-activity-7271892519578136576-ub3Z,"Dec 9, 2024 ... Full Time: - Mobile Developer (iOS, Android) We are hiring for one of our clients ""Mobile Developer"" at Pleasanton, CA (Onsite) : - At least ..."
We Are Hiring! — Expo | Keith Kurak,https://www.linkedin.com/posts/keith-kurak_we-are-hiring-expo-activity-7306403072870612992-Kk2C,"Mar 14, 2025 ... ... Mobile Developer. 5mo. Report this post; Close menu. If you like ... We Are Hiring! — Expo expo.dev · 72 · Like Comment."
We're expanding our team in Phoenix and looking to fill multiple ...,https://www.linkedin.com/posts/jalen-shetty_were-expanding-our-team-in-phoenix-and-looking-activity-7257336336028688387-7QJ9,"Oct 30, 2024 ... Mobile Developer 22. Site Reliability Engineer (SRE) 23. Business ... HIRING ALERT AUGUST 2024 Dear my connections, We are hiring for numerous IT ..."
#wearehiring #mobileappdeveloper #androiddeveloper ...,https://www.linkedin.com/posts/sana-waqas_wearehiring-mobileappdeveloper-androiddeveloper-activity-7282269280975433728-75C4,"Jan 6, 2025 ... Hi Everyone, We are #Hiring #IOS #Mobile Developer #Onsite in Iselin, NJ Share resume at Aman@fstonetechnologies.com JD:- Strong expertise ..."
Senior C# Engineers | Raphael Yoshiga,https://www.linkedin.com/posts/raphael-yoshiga_senior-c-engineers-i-am-looking-for-c-senior-activity-7275170181486706691-EVzU,"Dec 18, 2024 ... Remotely USD salaries from Egypt we are hiring for an American ... I-SOFT is hiring “Senior Mobile Developer” Salary is USD ($)."
We are hiring an iOS Developer at Software Development unit for ...,https://www.linkedin.com/posts/atatechnologyplatforms_we-are-hiring-anios-developer-at-software-activity-6425686659832049664-eThT,"Jul 19, 2018 ... We are hiring an iOS Developer at Software Development unit for our Tradesoft department. Please see the job post details at: ..."
We are Hiring About the role : We are seeking a skilled iOS ...,https://www.linkedin.com/posts/codezyng_we-are-hiring-about-the-role-we-are-activity-7227544373788352512-VmBF,"Aug 8, 2024 ... We are Hiring About the role : We are seeking a skilled iOS Developer to join our team. As an iOS Developer, you will be responsible for ..."
We are #Hiring for an Senior #Android Developer (#SDE II - L5; AGS ...,https://www.linkedin.com/posts/richa-shukla-87793323_software-dev-engineer-ii-android-global-activity-7338094544774754307-Q6hC,"Jun 9, 2025 ... We are #Hiring for an Senior #Android Developer ... SDE-3@Walmart (Sam's club) | iOS Developer | Blogger | Ex - Byju's | Ex- QuickRide."
Hello Folks! We are Hiring...! Open position : Business Development ...,https://www.linkedin.com/posts/sharmila-n-029759300_hello-folks-we-are-hiring-open-position-activity-7275839779026485248-ld-Q,"Dec 20, 2024 ... Hello Folks! We are Hiring...! Open position : Business Development Executive : 0-2years DotNet Developer : 1-3 years iOS Developer : 1-3 ..."
#hiring #developer #job #android #ios #digitalbanking ...,https://www.linkedin.com/posts/nf-innova_hiring-developer-job-activity-7008044496043036672-WBgw,"Dec 12, 2022 ... We are hiring. Senior IOS developer and Senior Android developer! If you are someone who: o is always thinking about product and clients o ..."
ChicMic Studios We are hiring! Open Positions: 1️⃣ PHP ...,https://www.linkedin.com/posts/mandeep-kaur-85b3b1158_chicmic-studios-we-are-hiring-open-positions-activity-7268128195793547264-EItO,"Nov 28, 2024 ... We are hiring! Open Positions: 1️⃣ PHP Developer (4+ years of experience) 2️⃣ React Developer (2+ years of experience) 3️⃣ iOS Developer (2+ years of experience)"
"Hi, We are hiring for below positions. 1. Lead Java Developer - 10+ ...",https://www.linkedin.com/posts/nandiniagarwal21_hi-we-are-hiring-for-below-positions-activity-7183774894206197760-Y9QD,"Apr 10, 2024 ... Hi, We are hiring for below positions. 1. Lead Java Developer - 10 ... iOS Developer | Flutter. 1y. Report this comment; Close menu. Ummed ..."
Written and read by Princess Momo AI made with Iris.la and we are ...,https://www.linkedin.com/posts/patrikarnesson_written-and-read-by-princess-momo-ai-made-activity-7180652454445813760-xDQM,"Apr 1, 2024 ... We are hiring. Contact Lidia Przytulska if you're: iOS Developer with experience in either camera, cloud or scaleable apps. A Frontend developer with a great ..."
"We are hiring! XYUG Technologies Pvt. Ltd., a leading IT company ...",https://www.linkedin.com/posts/x-yug-technologies-pvt-ltd_we-are-hiring-xyug-technologies-pvt-ltd-activity-7250114111865282560-hySj,"Oct 10, 2024 ... We are hiring! XYUG Technologies Pvt. Ltd., a leading IT company ... IOS Developer - 3 (3 Senior) DevOps - 1 (1 Mid-Level ) QA Manual ..."
Software Development Engineer - 2 (Mobile) | Abhishek Kumar,https://www.linkedin.com/posts/abhishek-kumar-2a4102115_software-development-engineer-2-mobile-activity-7315296026146353152-Q3bL,"Apr 8, 2025 ... We're Hiring at Quince!! Quince is expanding its #Mobile team in Bangalore and we are hiring ... Priyanka Thakur. Senior iOS Developer at Apptunix ..."
We are Hiring Medical Coder's Digital Forensic Investigator's Java ...,https://www.linkedin.com/posts/smartclues-technologies-llp_we-are-hiring-medical-coders-digital-activity-7236808911410839555-fILv,"Sep 3, 2024 ... We are Hiring Medical Coder's Digital Forensic Investigator's Java Developer's Android Developer's UI, UX Developer's | 210 comments on ..."
We are #Hiring for an Senior #Android Developer (#SDE II - L5; AGS ...,https://www.linkedin.com/posts/richa-shukla-87793323_software-dev-engineer-ii-android-global-activity-7338094544774754307-Q6hC,"Jun 9, 2025 ... We are #Hiring for an Senior #Android Developer (#SDE II - L5; AGS Org). If you're passionate about leading teams and driving innovation, ..."
WE ARE HIRING ! FLUTTER DEVELOPER For Pune Location Exp ...,https://www.linkedin.com/posts/accuresoftech_we-are-hiring-flutter-developer-for-pune-activity-7183802710872256512-BQbi,"Apr 10, 2024 ... WE ARE HIRING ! FLUTTER DEVELOPER For Pune Location Exp. 2+ Android Developer Salary - 20000 to 35000."
"Hello Connections, We are hiring for below positions: 1. Android ...",https://www.linkedin.com/posts/lbm-infotech-pvt-ltd_hello-connections-we-are-hiring-for-below-activity-7066726201498742784-FkiM,"May 23, 2023 ... Hello Connections, We are hiring for below positions: 1. Android Developer Location: Nashik Experience: 2 to 3 years 2."
We are Hiring: Flutter Developer Salary Range: KES 63k – 100k ...,https://www.linkedin.com/posts/derrick-bundi_we-are-hiring-flutter-developer-salary-activity-7327563988932673537-a_WO,"May 11, 2025 ... We are Hiring: Flutter Developer Salary Range: KES 63k – 100k ... Flutter Developer | Android Developer | Mobile App Freelancer | Dart ..."
"We are hiring "" flutter Developer"" Job Responsibilities: •Develop and ...",https://www.linkedin.com/posts/sohaila-mamdoh-b4301b244_we-are-hiring-flutter-developer-job-responsibilities-activity-7326935568045522944-8YU_,"May 10, 2025 ... We are hiring "" flutter Developer"" Job Responsibilities ... Android Developer + Flutter. 4mo. Report this comment; Close menu. I'm ..."
